,season,day,timestamp,description,event_type,parent_description,parent_event_type
0,11,56,2021-03-04 01:25:21+00:00,NaN is tangled in the flicker!,118,"Reality begins to flicker ...
But Hotbox Sato resists!
NaN is tangled in the flicker!",40
1,11,78,2021-03-05 00:10:18+00:00,Roscoe Sundae replaced the incinerated Case Sports.,116,"Rogue Umpire incinerated Case Sports!
They're replaced by Roscoe Sundae.",54
2,11,78,2021-03-05 00:14:35+00:00,Gita Sparrow replaced the incinerated Joshua Butt.,116,"Rogue Umpire incinerated Joshua Butt!
They're replaced by Gita Sparrow.",54
3,11,84,2021-03-05 06:03:47+00:00,Kline Greenlemon is Partying!,117,Kline Greenlemon is Partying!,24
4,11,84,2021-03-05 06:13:29+00:00,Gerund Pantheocide is Partying!,117,Gerund Pantheocide is Partying!,24
5,11,86,2021-03-05 08:12:58+00:00,Dickerson Morse is Partying!,117,Dickerson Morse is Partying!,24
6,11,86,2021-03-05 08:13:49+00:00,Helga Moreno is Partying!,117,Helga Moreno is Partying!,24
7,11,87,2021-03-05 09:02:10+00:00,August Sky is Partying!,117,August Sky is Partying!,24
8,11,87,2021-03-05 09:06:11+00:00,Cory Ross is Partying!,117,Cory Ross is Partying!,24
9,11,87,2021-03-05 09:09:02+00:00,Nandy Slumps is Partying!,117,Nandy Slumps is Partying!,24
10,11,87,2021-03-05 09:10:23+00:00,Knight Triumphant is Partying!,117,Knight Triumphant is Partying!,24
11,11,87,2021-03-05 09:24:24+00:00,Don Mitchell is Partying!,117,Don Mitchell is Partying!,24
12,11,88,2021-03-05 10:00:36+00:00,Patel Beyonce is Partying!,117,Patel Beyonce is Partying!,24
13,11,88,2021-03-05 10:22:32+00:00,Blood Hamburger is Partying!,117,Blood Hamburger is Partying!,24
14,11,89,2021-03-05 11:13:59+00:00,Blood Hamburger is Partying!,117,Blood Hamburger is Partying!,24
15,11,89,2021-03-05 11:20:16+00:00,Sixpack Dogwalker is Partying!,117,Sixpack Dogwalker is Partying!,24
16,11,89,2021-03-05 11:23:36+00:00,Richardson Games is Partying!,117,Richardson Games is Partying!,24
17,11,89,2021-03-05 11:24:01+00:00,Ronan Jaylee is Partying!,117,Ronan Jaylee is Partying!,24
18,11,89,2021-03-05 11:32:18+00:00,Helga Burton is Partying!,117,Helga Burton is Partying!,24
19,11,90,2021-03-05 12:01:16+00:00,Howell Franklin is Partying!,117,Howell Franklin is Partying!,24
20,11,90,2021-03-05 12:08:28+00:00,Theo King is Partying!,117,Theo King is Partying!,24
21,11,91,2021-03-05 13:23:36+00:00,Logan Rodriguez is Partying!,117,Logan Rodriguez is Partying!,24
22,11,91,2021-03-05 13:25:37+00:00,Kichiro Guerra is Partying!,117,Kichiro Guerra is Partying!,24
23,11,91,2021-03-05 13:28:03+00:00,James Mora is Partying!,117,James Mora is Partying!,24
24,11,91,2021-03-05 13:30:34+00:00,Cornelius Games is Partying!,117,Cornelius Games is Partying!,24
25,11,92,2021-03-05 14:02:56+00:00,Bontgomery Mullock is Partying!,117,Bontgomery Mullock is Partying!,24
26,11,92,2021-03-05 14:09:28+00:00,Sebastian Woodman is Partying!,117,Sebastian Woodman is Partying!,24
27,11,92,2021-03-05 14:26:07+00:00,Patel Beyonce is Partying!,117,Patel Beyonce is Partying!,24
28,11,93,2021-03-05 15:02:16+00:00,Wyatt Glover is Partying!,117,Wyatt Glover is Partying!,24
29,11,93,2021-03-05 15:06:42+00:00,Gloria Bugsnax is Partying!,117,Gloria Bugsnax is Partying!,24
30,11,93,2021-03-05 15:16:46+00:00,Francisco Preston is Partying!,117,Francisco Preston is Partying!,24
31,11,93,2021-03-05 15:22:27+00:00,Sutton Picklestein is Partying!,117,Sutton Picklestein is Partying!,24
32,11,93,2021-03-05 15:24:03+00:00,Sam Scandal is Partying!,117,Sam Scandal is Partying!,24
33,11,94,2021-03-05 16:02:16+00:00,Rat Mason is Partying!,117,Rat Mason is Partying!,24
34,11,94,2021-03-05 16:06:51+00:00,PolkaDot Zavala is Partying!,117,PolkaDot Zavala is Partying!,24
35,11,94,2021-03-05 16:07:57+00:00,Valentine Games is Partying!,117,Valentine Games is Partying!,24
36,11,94,2021-03-05 16:14:04+00:00,Beck Whitney is Partying!,117,Beck Whitney is Partying!,24
37,11,94,2021-03-05 16:19:10+00:00,Mooney Doctor II is Partying!,117,Mooney Doctor II is Partying!,24
38,11,94,2021-03-05 16:25:32+00:00,Dunn Keyes is Partying!,117,Dunn Keyes is Partying!,24
39,11,95,2021-03-05 17:04:32+00:00,Bevan Wise is Partying!,117,Bevan Wise is Partying!,24
40,11,95,2021-03-05 17:16:20+00:00,Rai Spliff is Partying!,117,Rai Spliff is Partying!,24
41,11,95,2021-03-05 17:19:01+00:00,Nandy Slumps is Partying!,117,Nandy Slumps is Partying!,24
42,11,95,2021-03-05 17:20:30+00:00,Yosh Carpenter is Partying!,117,Yosh Carpenter is Partying!,24
43,11,95,2021-03-05 17:23:17+00:00,Kline Greenlemon is Partying!,117,Kline Greenlemon is Partying!,24
44,11,96,2021-03-05 18:05:51+00:00,King Weatherman is Partying!,117,King Weatherman is Partying!,24
45,11,96,2021-03-05 18:07:06+00:00,Eizabeth Elliott is Partying!,117,Eizabeth Elliott is Partying!,24
46,11,96,2021-03-05 18:10:42+00:00,Tillman Henderson is Partying!,117,Tillman Henderson is Partying!,24
47,11,96,2021-03-05 18:20:50+00:00,Sam Scandal is Partying!,117,Sam Scandal is Partying!,24
48,11,96,2021-03-05 18:30:55+00:00,Washer Barajas is Partying!,117,Washer Barajas is Partying!,24
49,11,96,2021-03-05 18:32:54+00:00,Rodriguez Internet is Partying!,117,Rodriguez Internet is Partying!,24
50,11,96,2021-03-05 18:34:16+00:00,Oscar Dollie is Partying!,117,Oscar Dollie is Partying!,24
51,11,97,2021-03-05 19:02:16+00:00,Curry Aliciakeyes is Partying!,117,Curry Aliciakeyes is Partying!,24
52,11,97,2021-03-05 19:02:41+00:00,Castillo Turner is Partying!,117,Castillo Turner is Partying!,24
53,11,97,2021-03-05 19:04:07+00:00,Lenny Spruce is Partying!,117,Lenny Spruce is Partying!,24
54,11,97,2021-03-05 19:08:03+00:00,Sandford Garner is Partying!,117,Sandford Garner is Partying!,24
55,11,97,2021-03-05 19:09:14+00:00,Mullen Peterson is Partying!,117,Mullen Peterson is Partying!,24
56,11,97,2021-03-05 19:12:24+00:00,Elwin McGhee is Partying!,117,Elwin McGhee is Partying!,24
57,11,97,2021-03-05 19:20:21+00:00,Allison Abbott is Partying!,117,Allison Abbott is Partying!,24
58,11,97,2021-03-05 19:22:01+00:00,Rai Spliff is Partying!,117,Rai Spliff is Partying!,24
59,11,98,2021-03-05 20:01:51+00:00,Lance Serotonin is Partying!,117,Lance Serotonin is Partying!,24
60,11,98,2021-03-05 20:05:01+00:00,Randy Dennis is Partying!,117,Randy Dennis is Partying!,24
61,11,98,2021-03-05 20:10:38+00:00,Fletcher Yamamoto is Partying!,117,Fletcher Yamamoto is Partying!,24
62,11,98,2021-03-05 20:18:09+00:00,Lachlan Shelton is Partying!,117,Lachlan Shelton is Partying!,24
63,11,98,2021-03-05 20:20:54+00:00,Kit Adamses is Partying!,117,Kit Adamses is Partying!,24
64,11,98,2021-03-05 20:23:54+00:00,Richardson Games is Partying!,117,Richardson Games is Partying!,24
65,11,98,2021-03-05 21:01:00+00:00,The Fridays earn a Postseason Birth!,109,The Fridays earn a Postseason Birth!,109
66,11,98,2021-03-05 21:01:00+00:00,The Firefighters earn a Postseason Birth!,109,The Firefighters earn a Postseason Birth!,109
67,11,98,2021-03-05 21:01:00+00:00,The Shoe Thieves earn a Postseason Birth!,109,The Shoe Thieves earn a Postseason Birth!,109
68,11,98,2021-03-05 21:01:00+00:00,The Wild Wings earn a Postseason Birth!,109,The Wild Wings earn a Postseason Birth!,109
69,11,98,2021-03-05 21:01:00+00:00,The Tigers earn a Postseason Birth!,109,The Tigers earn a Postseason Birth!,109
70,11,98,2021-03-05 21:01:00+00:00,The Garages earn a Postseason Birth!,109,The Garages earn a Postseason Birth!,109
71,11,98,2021-03-05 21:01:00+00:00,The Millennials earn a Postseason Birth!,109,The Millennials earn a Postseason Birth!,109
72,11,98,2021-03-05 21:01:00+00:00,The Jazz Hands earn a Postseason Birth!,109,The Jazz Hands earn a Postseason Birth!,109
73,11,98,2021-03-05 21:01:00+00:00,The Pies earn a Postseason Birth!,109,The Pies earn a Postseason Birth!,109
74,11,98,2021-03-05 21:01:00+00:00,The Sunbeams earn a Postseason Birth!,109,The Sunbeams earn a Postseason Birth!,109
75,11,115,2021-03-06 23:25:43+00:00,Kaz Fiasco was boosted.,117,The Worms are Bottom Dwellers.,117
76,11,115,2021-03-06 23:25:43+00:00,Huber Frumple was boosted.,117,The Worms are Bottom Dwellers.,117
77,11,115,2021-03-06 23:25:43+00:00,Vessalius Sundae was boosted.,117,The Worms are Bottom Dwellers.,117
78,11,115,2021-03-06 23:25:43+00:00,Lenny Crumb was boosted.,117,The Worms are Bottom Dwellers.,117
79,11,115,2021-03-06 23:25:43+00:00,Ephraim Ladd was boosted.,117,The Worms are Bottom Dwellers.,117
80,11,115,2021-03-06 23:25:43+00:00,Persephone Splotter was boosted.,117,The Worms are Bottom Dwellers.,117
81,11,115,2021-03-06 23:25:43+00:00,Muse Scantron was boosted.,117,The Worms are Bottom Dwellers.,117
82,11,115,2021-03-06 23:25:43+00:00,Cantus Hojo was boosted.,117,The Worms are Bottom Dwellers.,117
83,11,115,2021-03-06 23:25:43+00:00,Mindy Kugel was boosted.,117,The Worms are Bottom Dwellers.,117
84,11,115,2021-03-06 23:25:43+00:00,Augusta Chadwell was boosted.,117,The Worms are Bottom Dwellers.,117
85,11,115,2021-03-06 23:25:43+00:00,Enid Marlow was boosted.,117,The Worms are Bottom Dwellers.,117
86,11,115,2021-03-06 23:25:43+00:00,Wanda Schenn was boosted.,117,The Worms are Bottom Dwellers.,117
87,11,115,2021-03-06 23:25:43+00:00,Patchwork Southwick was boosted.,117,The Worms are Bottom Dwellers.,117
88,11,115,2021-03-06 23:25:43+00:00,Scratch Deleuze was boosted.,117,The Worms are Bottom Dwellers.,117
89,11,115,2021-03-07 19:01:04+00:00,Bevan Underbuck entered the Shadows.,117,Will Received: Foreshadow,61
90,11,115,2021-03-07 19:01:04+00:00,Huber Frumple is Infused.,117,Will Received: Infuse,61
91,11,115,2021-03-07 19:01:04+00:00,Logan Horseman is Infused.,117,Will Received: Infuse,61
92,11,115,2021-03-07 19:01:04+00:00,Declan Suzanne entered the Shadows.,117,Will Received: Foreshadow,61
93,11,115,2021-03-07 19:01:04+00:00,Charlatan Seabright entered the Shadows.,117,Will Received: Foreshadow,61
94,11,115,2021-03-07 19:01:04+00:00,Tamara Crankit is Infused.,117,Will Received: Infuse,61
95,11,115,2021-03-07 19:01:04+00:00,Leach Herman is Infused.,117,Will Received: Infuse,61
96,11,115,2021-03-07 19:01:04+00:00,Concrete Mandible entered the Shadows.,117,Will Received: Foreshadow,61
97,11,115,2021-03-07 19:01:04+00:00,Sexton Wheerer is Infused.,117,Will Received: Infuse,61
98,11,115,2021-03-07 19:01:04+00:00,Betsy Trombone is Infused.,117,Will Received: Infuse,61
99,11,115,2021-03-07 19:01:04+00:00,Fletcher Yamamoto entered the Shadows.,117,Will Received: Foreshadow,61
100,11,115,2021-03-07 19:01:04+00:00,Alaynabella Hollywood entered the Shadows.,117,Will Received: Foreshadow,61
101,11,115,2021-03-07 19:01:04+00:00,Ruslan Greatness is Infused.,117,Will Received: Infuse,61
102,11,115,2021-03-07 19:01:04+00:00,Cory Twelve's Alternate is called.,145,Will Received: Alternate,61
103,11,115,2021-03-07 19:01:04+00:00,Greer Lott is Infused.,117,Will Received: Infuse,61
104,11,115,2021-03-07 19:01:04+00:00,Joshua Butt is Infused.,117,Will Received: Infuse,61
105,11,115,2021-03-07 19:01:04+00:00,Alyssa Harrell is Infused.,117,Will Received: Infuse,61
106,11,115,2021-03-07 19:01:04+00:00,Ren Morin entered the Shadows.,117,Will Received: Foreshadow,61
107,11,115,2021-03-07 19:01:04+00:00,Sosa Hayes is Infused.,117,Will Received: Infuse,61
108,11,115,2021-03-07 19:01:04+00:00,Quinns Jespersen entered the Shadows.,117,Will Received: Foreshadow,61
109,11,115,2021-03-07 19:01:04+00:00,Gallup Crueller's Alternate is called.,145,Will Received: Alternate,61
110,11,115,2021-03-07 19:01:04+00:00,Nagomi Mcdaniel entered the Shadows.,117,Will Received: Exchange,61
111,11,115,2021-03-07 19:01:04+00:00,Sandie Turner is Infused.,117,Will Received: Infuse,61
112,11,115,2021-03-07 19:01:04+00:00,Peanut Bong entered the Shadows.,117,Will Received: Foreshadow,61
113,11,115,2021-03-07 19:01:04+00:00,Pudge Nakamoto is Infused.,117,Will Received: Infuse,61
114,11,115,2021-03-07 19:01:04+00:00,Rigby Friedrich is Infused.,117,Will Received: Infuse,61
115,11,115,2021-03-07 19:01:04+00:00,Tillman Henderson is Infused.,117,Will Received: Infuse,61
116,11,115,2021-03-07 19:01:05+00:00,Adalberto Tosser's pitching was boosted.,117,"Blessing Won: Tag Team Pitching, Firefighters",60
117,11,115,2021-03-07 19:01:05+00:00,Kennedy Loser's defense was boosted.,117,"Blessing Won: The Rack, Crabs",60
118,11,115,2021-03-07 19:01:05+00:00,Scratch Deleuze's hitting was boosted.,117,"Blessing Won: Tag Team Hitting, Moist Talkers",60
119,11,115,2021-03-07 19:01:05+00:00,Finn James' pitching was boosted.,117,"Blessing Won: Tag Team Pitching, Firefighters",60
120,11,115,2021-03-07 19:01:05+00:00,Baldwin Breadwinner's defense was boosted.,117,"Blessing Won: The Rack, Crabs",60
121,11,115,2021-03-07 19:01:05+00:00,Pitching Machine's hitting was boosted.,117,"Blessing Won: Tag Team Hitting, Moist Talkers",60
122,11,115,2021-03-07 19:01:05+00:00,Finn James' defense was boosted.,117,"Blessing Won: The Rack, Crabs",60
123,11,115,2021-03-07 19:01:05+00:00,Forrest Best's defense was boosted.,117,"Blessing Won: The Rack, Crabs",60
124,11,115,2021-03-07 19:01:05+00:00,Luis Acevedo's defense was boosted.,117,"Blessing Won: The Rack, Crabs",60
125,11,115,2021-03-07 19:01:05+00:00,Commissioner Vapor's hitting was boosted.,117,"Blessing Won: Tag Team Hitting, Moist Talkers",60
126,11,115,2021-03-07 19:01:05+00:00,Squid Galvanic's defense was boosted.,117,"Blessing Won: The Rack, Crabs",60
127,11,115,2021-03-07 19:01:05+00:00,Kennedy Rodgers' pitching was boosted.,117,"Blessing Won: Tag Team Pitching, Firefighters",60
128,11,115,2021-03-07 19:01:05+00:00,Cedric Spliff's hitting was boosted.,117,"Blessing Won: Tag Team Hitting, Moist Talkers",60
129,11,115,2021-03-07 19:01:05+00:00,Wesley Poole's pitching was boosted.,117,"Blessing Won: Tag Team Pitching, Firefighters",60
130,11,115,2021-03-07 19:01:05+00:00,Agan Harrison's pitching was re-rolled.,119,"Blessing Won: Organ Replacements, Firefighters",60
131,11,115,2021-03-07 19:01:05+00:00,Beans McBlase's hitting was boosted.,117,"Blessing Won: Tag Team Hitting, Moist Talkers",60
132,11,115,2021-03-07 19:01:05+00:00,Jacoby Podcast's defense was boosted.,117,"Blessing Won: The Rack, Crabs",60
133,11,115,2021-03-07 19:01:05+00:00,Halexandrey Walton's baserunning was boosted.,117,"Blessing Won: Wind Sprints, Tacos",60
134,11,115,2021-03-07 19:01:05+00:00,Cantus Hojo's hitting was boosted.,117,"Blessing Won: Tag Team Hitting, Moist Talkers",60
135,11,115,2021-03-07 19:01:05+00:00,Kaz Fiasco's hitting was boosted.,117,"Blessing Won: Tag Team Hitting, Moist Talkers",60
136,11,115,2021-03-07 19:01:05+00:00,Rivers Rosa's pitching was boosted.,117,"Blessing Won: Tag Team Pitching, Firefighters",60
137,11,115,2021-03-07 19:01:05+00:00,Chorby Short's hitting was re-rolled.,119,"Blessing Won: Summoning Circle, Magic",60
138,11,115,2021-03-07 19:01:05+00:00,Basilio Mason's baserunning was boosted.,117,"Blessing Won: Wind Sprints, Tacos",60
139,11,115,2021-03-07 19:01:05+00:00,Lachlan Shelton's hitting was boosted.,117,"Blessing Won: Tag Team Hitting, Moist Talkers",60
140,11,115,2021-03-07 19:01:05+00:00,Caleb Alvarado's pitching was boosted.,117,"Blessing Won: Tag Team Pitching, Firefighters",60
141,11,115,2021-03-07 19:01:05+00:00,The Worms' hitting was boosted.,117,"Blessing Won: Tag Team Hitting, Moist Talkers",60
142,11,115,2021-03-07 19:01:05+00:00,Ziwa Mueller's hitting was boosted.,117,"Blessing Won: Tag Team Hitting, Moist Talkers",60
143,11,115,2021-03-07 19:01:05+00:00,Tot Fox's defense was boosted.,117,"Blessing Won: The Rack, Crabs",60
144,11,115,2021-03-07 19:01:05+00:00,The Firefighters' pitching was boosted.,117,"Blessing Won: Tag Team Pitching, Firefighters",60
145,11,115,2021-03-07 19:01:05+00:00,The Crabs' pitching was boosted.,117,"Blessing Won: Tag Team Pitching, Firefighters",60
146,11,115,2021-03-07 19:01:05+00:00,Parker Parra's defense was boosted.,117,"Blessing Won: The Rack, Crabs",60
147,11,115,2021-03-07 19:01:05+00:00,Jesús Koch's hitting was boosted.,117,"Blessing Won: Tag Team Hitting, Moist Talkers",60
148,11,115,2021-03-07 19:01:05+00:00,The Moist Talkers' hitting was boosted.,117,"Blessing Won: Tag Team Hitting, Moist Talkers",60
149,11,115,2021-03-07 19:01:05+00:00,Adalberto Tosser's defense was boosted.,117,"Blessing Won: The Rack, Crabs",60
150,11,115,2021-03-07 19:01:05+00:00,The Tacos' baserunning was boosted.,117,"Blessing Won: Wind Sprints, Tacos",60
151,11,115,2021-03-07 19:01:05+00:00,Silvaire Roadhouse's defense was boosted.,117,"Blessing Won: The Rack, Crabs",60
152,11,115,2021-03-07 19:01:05+00:00,Vito Kravitz's baserunning was boosted.,117,"Blessing Won: Wind Sprints, Tacos",60
153,11,115,2021-03-07 19:01:05+00:00,Fish Summer's hitting was boosted.,117,"Blessing Won: Tag Team Hitting, Moist Talkers",60
154,11,115,2021-03-07 19:01:05+00:00,Brock Forbes' defense was boosted.,117,"Blessing Won: The Rack, Crabs",60
155,11,115,2021-03-07 19:01:05+00:00,Wyatt Glover's hitting was re-rolled.,119,"Blessing Won: Summoning Circle, Magic",60
156,11,115,2021-03-07 19:01:05+00:00,Kennedy Rodgers' pitching was re-rolled.,119,"Blessing Won: Organ Replacements, Firefighters",60
157,11,115,2021-03-07 19:01:05+00:00,The Crabs' defense was boosted.,117,"Blessing Won: The Rack, Crabs",60
158,11,115,2021-03-07 19:01:05+00:00,Augusta Chadwell's hitting was boosted.,117,"Blessing Won: Tag Team Hitting, Moist Talkers",60
159,11,115,2021-03-07 19:01:05+00:00,Brock Forbes' pitching was boosted.,117,"Blessing Won: Tag Team Pitching, Firefighters",60
160,11,115,2021-03-07 19:01:05+00:00,Valentine Games' baserunning was boosted.,117,"Blessing Won: Wind Sprints, Tacos",60
161,11,115,2021-03-07 19:01:05+00:00,Eugenia Garbage's hitting was boosted.,117,"Blessing Won: Tag Team Hitting, Moist Talkers",60
162,11,115,2021-03-07 19:01:05+00:00,Jacoby Podcast's pitching was boosted.,117,"Blessing Won: Tag Team Pitching, Firefighters",60
163,11,115,2021-03-07 19:01:05+00:00,York Silk's hitting was boosted.,117,"Blessing Won: Tag Team Hitting, Moist Talkers",60
164,11,115,2021-03-07 19:01:05+00:00,Lenny Crumb's hitting was boosted.,117,"Blessing Won: Tag Team Hitting, Moist Talkers",60
165,11,115,2021-03-07 19:01:05+00:00,Vessalius Sundae's hitting was boosted.,117,"Blessing Won: Tag Team Hitting, Moist Talkers",60
166,11,115,2021-03-07 19:01:05+00:00,Pedro Davids' defense was boosted.,117,"Blessing Won: The Rack, Crabs",60
167,11,115,2021-03-07 19:01:05+00:00,Alston Cerveza's hitting was boosted.,117,"Blessing Won: Tag Team Hitting, Moist Talkers",60
168,11,115,2021-03-07 19:01:05+00:00,Muse Scantron's hitting was boosted.,117,"Blessing Won: Tag Team Hitting, Moist Talkers",60
169,11,115,2021-03-07 19:01:05+00:00,Evelton McBlase II's defense was boosted.,117,"Blessing Won: The Rack, Crabs",60
170,11,115,2021-03-07 19:01:05+00:00,Mcdowell Mason's baserunning was boosted.,117,"Blessing Won: Wind Sprints, Tacos",60
171,11,115,2021-03-07 19:01:05+00:00,Basilio Fig's baserunning was boosted.,117,"Blessing Won: Wind Sprints, Tacos",60
172,11,115,2021-03-07 19:01:05+00:00,Agan Harrison's pitching was re-rolled.,119,"Blessing Won: Organ Replacements, Firefighters",60
173,11,115,2021-03-07 19:01:05+00:00,Farrell Seagull's hitting was boosted.,117,"Blessing Won: Tag Team Hitting, Moist Talkers",60
174,11,115,2021-03-07 19:01:05+00:00,Agan Harrison's pitching was boosted.,117,"Blessing Won: Tag Team Pitching, Firefighters",60
175,11,115,2021-03-07 19:01:05+00:00,Rat Mason's baserunning was boosted.,117,"Blessing Won: Wind Sprints, Tacos",60
176,11,115,2021-03-07 19:01:05+00:00,Chorby Short's hitting was re-rolled.,119,"Blessing Won: Summoning Circle, Magic",60
177,12,12,2021-03-09 04:12:33+00:00,Kurt Crueller replaced the incinerated Sutton Picklestein.,116,"Rogue Umpire incinerated Sutton Picklestein!
They're replaced by Kurt Crueller.",54
178,12,19,2021-03-09 11:15:29+00:00,Alx Keming replaced the incinerated Hotbox Sato.,116,"Rogue Umpire incinerated Hotbox Sato!
They're replaced by Alx Keming.",54
179,12,29,2021-03-09 22:03:16+00:00,Jasper Blather replaced the incinerated Hands Scoresburg.,116,"Rogue Umpire incinerated Hands Scoresburg!
They're replaced by Jasper Blather.",54
180,12,42,2021-03-10 11:02:16+00:00,Riley Firewall replaced the incinerated Raúl Leal.,116,"Rogue Umpire incinerated Raúl Leal!
They're replaced by Riley Firewall.",54
181,12,67,2021-03-11 12:36:23+00:00,Pitching Mach-ne is Partying!,117,Pitching Mach-ne is Partying!,24
182,12,70,2021-03-11 15:02:16+00:00,Ephraim Ladd is Partying!,117,Ephraim Ladd is Partying!,24
183,12,71,2021-03-11 16:10:08+00:00,Wanda Schenn is Partying!,117,Wanda Schenn is Partying!,24
184,12,71,2021-03-11 16:22:50+00:00,Kaz Fiasco is Partying!,117,Kaz Fiasco is Partying!,24
185,12,71,2021-03-11 16:27:06+00:00,Farrell Seagull is Partying!,117,Farrell Seagull is Partying!,24
186,12,75,2021-03-11 21:22:17+00:00,Val Hitherto is Partying!,117,Val Hitherto is Partying!,24
187,12,75,2021-03-11 21:23:02+00:00,Grollis Zephyr is Partying!,117,Grollis Zephyr is Partying!,24
188,12,76,2021-03-11 22:03:11+00:00,Ayanna Dumpington is Partying!,117,Ayanna Dumpington is Partying!,24
189,12,76,2021-03-11 22:05:37+00:00,Norris Firestar replaced the incinerated Theodore Holloway.,116,"Rogue Umpire incinerated Theodore Holloway!
They're replaced by Norris Firestar.",54
190,12,77,2021-03-11 23:13:49+00:00,Tai Beanbag replaced the incinerated Lawrence Horne.,116,"Rogue Umpire incinerated Lawrence Horne!
They're replaced by Tai Beanbag.",54
191,12,77,2021-03-11 23:20:23+00:00,Gerund Pantheocide is Partying!,117,Gerund Pantheocide is Partying!,24
192,12,77,2021-03-11 23:22:23+00:00,Gerund Pantheocide is Partying!,117,Gerund Pantheocide is Partying!,24
193,12,78,2021-03-12 00:00:41+00:00,Enid Marlow is Partying!,117,Enid Marlow is Partying!,24
194,12,78,2021-03-12 00:03:31+00:00,Val Hitherto is Partying!,117,Val Hitherto is Partying!,24
195,12,78,2021-03-12 00:21:05+00:00,Coolname Galvanic is Partying!,117,Coolname Galvanic is Partying!,24
196,12,78,2021-03-12 00:22:05+00:00,Adelaide Judochop replaced the incinerated Ruffian Applesauce.,116,"Rogue Umpire incinerated Ruffian Applesauce!
They're replaced by Adelaide Judochop.",54
197,12,79,2021-03-12 01:28:59+00:00,Wanda Schenn is Partying!,117,Wanda Schenn is Partying!,24
198,12,80,2021-03-12 02:03:36+00:00,Silvaire Semiquaver is Partying!,117,Silvaire Semiquaver is Partying!,24
199,12,80,2021-03-12 02:08:23+00:00,Niq Nyong'o is Partying!,117,Niq Nyong'o is Partying!,24
200,12,80,2021-03-12 02:16:14+00:00,Frankie Hambone is Partying!,117,Frankie Hambone is Partying!,24
201,12,81,2021-03-12 03:03:51+00:00,Pitching Machine is Partying!,117,Pitching Machine is Partying!,24
202,12,81,2021-03-12 03:04:46+00:00,Winnie Hess is Partying!,117,Winnie Hess is Partying!,24
203,12,81,2021-03-12 03:13:54+00:00,Leach Ingram is Partying!,117,Leach Ingram is Partying!,24
204,12,81,2021-03-12 03:14:00+00:00,Scratch Deleuze is Partying!,117,Scratch Deleuze is Partying!,24
205,12,82,2021-03-12 04:04:37+00:00,Stijn Strongbody is Partying!,117,Stijn Strongbody is Partying!,24
206,12,82,2021-03-12 04:12:24+00:00,Lance Serotonin is Partying!,117,Lance Serotonin is Partying!,24
207,12,82,2021-03-12 04:25:27+00:00,Grey Alvarado is Partying!,117,Grey Alvarado is Partying!,24
208,12,83,2021-03-12 05:13:39+00:00,Jolene Willowtree is Partying!,117,Jolene Willowtree is Partying!,24
209,12,84,2021-03-12 06:01:00+00:00,Simon Haley is Partying!,117,Simon Haley is Partying!,24
210,12,84,2021-03-12 06:03:06+00:00,Geraldine Frost is Partying!,117,Geraldine Frost is Partying!,24
211,12,84,2021-03-12 06:20:10+00:00,Vessalius Sundae is Partying!,117,Vessalius Sundae is Partying!,24
212,12,84,2021-03-12 06:30:41+00:00,Erin Jesaulenko is Partying!,117,Erin Jesaulenko is Partying!,24
213,12,85,2021-03-12 07:08:03+00:00,Hercules Alighieri is Partying!,117,Hercules Alighieri is Partying!,24
214,12,85,2021-03-12 07:10:13+00:00,Winnie Hess is Partying!,117,Winnie Hess is Partying!,24
215,12,85,2021-03-12 07:10:28+00:00,Jasper Blather is Partying!,117,Jasper Blather is Partying!,24
216,12,85,2021-03-12 07:16:29+00:00,Hewitt Best is Partying!,117,Hewitt Best is Partying!,24
217,12,85,2021-03-12 07:26:01+00:00,Scratch Deleuze is Partying!,117,Scratch Deleuze is Partying!,24
218,12,86,2021-03-12 08:08:06+00:00,Lenny Spruce is Partying!,117,Lenny Spruce is Partying!,24
219,12,86,2021-03-12 08:08:41+00:00,Jasper Blather is Partying!,117,Jasper Blather is Partying!,24
220,12,86,2021-03-12 08:09:02+00:00,Lance Serotonin is Partying!,117,Lance Serotonin is Partying!,24
221,12,86,2021-03-12 08:10:42+00:00,Mindy Kugel is Partying!,117,Mindy Kugel is Partying!,24
222,12,86,2021-03-12 08:10:57+00:00,Jaxon Buckley is Partying!,117,Jaxon Buckley is Partying!,24
223,12,86,2021-03-12 08:12:52+00:00,Zoey Kirchner is Partying!,117,Zoey Kirchner is Partying!,24
224,12,86,2021-03-12 08:19:05+00:00,Yusef Fenestrate is Partying!,117,Yusef Fenestrate is Partying!,24
225,12,86,2021-03-12 08:24:15+00:00,Lotus Mango is Partying!,117,Lotus Mango is Partying!,24
226,12,86,2021-03-12 08:27:41+00:00,Lang Richardson is Partying!,117,Lang Richardson is Partying!,24
227,12,87,2021-03-12 09:03:57+00:00,Fitzgerald Wanderlust is Partying!,117,Fitzgerald Wanderlust is Partying!,24
228,12,87,2021-03-12 09:15:44+00:00,Elvis Figueroa is Partying!,117,Elvis Figueroa is Partying!,24
229,12,87,2021-03-12 09:25:21+00:00,Vessalius Sundae is Partying!,117,Vessalius Sundae is Partying!,24
230,12,88,2021-03-12 10:01:51+00:00,Parker Meng is Partying!,117,Parker Meng is Partying!,24
231,12,88,2021-03-12 10:01:56+00:00,Theo King is Partying!,117,Theo King is Partying!,24
232,12,88,2021-03-12 10:06:32+00:00,Loubert Ji-Eun replaced the incinerated Augusta Chadwell.,116,"Rogue Umpire incinerated Augusta Chadwell!
They're replaced by Loubert Ji-Eun.",54
233,12,88,2021-03-12 10:07:07+00:00,Jasper Blather is Partying!,117,Jasper Blather is Partying!,24
234,12,88,2021-03-12 10:08:33+00:00,Wyatt Quitter is Partying!,117,Wyatt Quitter is Partying!,24
235,12,88,2021-03-12 10:10:28+00:00,Ephraim Ladd is Partying!,117,Ephraim Ladd is Partying!,24
