,season,day,timestamp,description,event_type,parent_description,parent_event_type
2212,19,97,2021-06-18 18:16:37+00:00,Castillo Turner is Partying!,117,Castillo Turner is Partying!,24
2213,19,97,2021-06-18 18:18:01+00:00,Halexa-dr-y --lton is Partying!,117,Halexa-dr-y --lton is Partying!,24
2214,19,97,2021-06-18 18:18:33+00:00,Kennedy Loser is Partying!,117,Kennedy Loser is Partying!,24
2215,19,97,2021-06-18 18:18:43+00:00,Commissioner Vapor is Partying!,117,Commissioner Vapor is Partying!,24
2216,19,97,2021-06-18 18:19:18+00:00,Scratch Deleuze is Partying!,117,Scratch Deleuze is Partying!,24
2217,19,97,2021-06-18 18:21:03+00:00,Dunlap Figueroa is Partying!,117,Dunlap Figueroa is Partying!,24
2218,19,97,2021-06-18 18:24:29+00:00,Malik Destiny is Partying!,117,Malik Destiny is Partying!,24
2219,19,97,2021-06-18 18:26:45+00:00,Oliver Notarobot is Partying!,117,Oliver Notarobot is Partying!,24
2220,19,97,2021-06-18 18:26:57+00:00,Inez Owens is Partying!,117,Inez Owens is Partying!,24
2221,19,98,2021-06-18 19:00:39+00:00,Clare Mccall is Partying!,117,Clare Mccall is Partying!,24
2222,19,98,2021-06-18 19:05:21+00:00,Scarlet Caster is Partying!,117,Scarlet Caster is Partying!,24
2223,19,98,2021-06-18 19:09:45+00:00,Parker Meng is Partying!,117,Parker Meng is Partying!,24
2224,19,98,2021-06-18 19:18:33+00:00,Commissioner Vapor is Partying!,117,Commissioner Vapor is Partying!,24
2225,19,98,2021-06-18 19:23:19+00:00,Theo King is Partying!,117,Theo King is Partying!,24
2226,19,98,2021-06-18 19:28:59+00:00,Eizabeth Elliott is Partying!,117,Eizabeth Elliott is Partying!,24
2227,19,98,2021-06-18 19:32:41+00:00,Tiana Wheeler is Partying!,117,Tiana Wheeler is Partying!,24
2228,19,98,2021-06-18 20:01:00+00:00,Borg Ruiz entered the Shadows.,117,The Sunbeams earned a Postseason Birth!,109
2229,19,98,2021-06-18 20:01:00+00:00,Xandra Yolk entered the Shadows.,117,The Georgias earned a Postseason Birth!,109
2230,19,98,2021-06-18 20:01:00+00:00,Vipsanius Ng entered the Shadows.,117,The Tacos earned a Postseason Birth!,109
2231,19,98,2021-06-18 20:01:00+00:00,Plums Blather entered the Shadows.,117,The Spies earned a Postseason Birth!,109
2232,19,98,2021-06-18 20:01:00+00:00,Marf Whammy entered the Shadows.,117,The Flowers earned a Postseason Birth!,109
2233,19,98,2021-06-18 20:01:00+00:00,Balina Erock entered the Shadows.,117,The Steaks earned a Postseason Birth!,109
2234,19,98,2021-06-18 20:01:00+00:00,Fairwood Patchwork entered the Shadows.,117,The Garages earned a Postseason Birth!,109
2235,19,98,2021-06-18 20:01:00+00:00,Leo Baron entered the Shadows.,117,The Magic earned a Postseason Birth!,109
2236,19,98,2021-06-18 20:01:00+00:00,Edith Patchwork entered the Shadows.,117,The Breath Mints earned a Postseason Birth!,109
2237,19,98,2021-06-18 20:01:00+00:00,Ilane Snart entered the Shadows.,117,The Mechanics earned a Postseason Birth!,109
2238,19,98,2021-06-18 20:01:00+00:00,Domino Bootleg entered the Shadows.,117,The Lift earned a Postseason Birth!,109
2239,19,98,2021-06-18 20:01:00+00:00,Stan Schofield entered the Shadows.,117,The Wild Wings earned a Postseason Birth!,109
2240,19,98,2021-06-18 20:01:00+00:00,Yams Sokol entered the Shadows.,117,The Jazz Hands earned a Postseason Birth!,109
2241,19,98,2021-06-18 20:01:00+00:00,Paco Junebug entered the Shadows.,117,The Moist Talkers earned a Postseason Birth!,109
2242,19,98,2021-06-18 20:01:00+00:00,Willow Dice entered the Shadows.,117,The Dale earned a Postseason Birth!,109
2243,19,98,2021-06-18 20:01:00+00:00,Blimp Hardison entered the Shadows.,117,The Lovers earned a Postseason Birth!,109
2244,19,98,2021-06-18 20:01:00+00:00,Kit Seraph entered the Shadows.,117,The Worms earned a Postseason Birth!,109
2245,19,98,2021-06-18 20:01:00+00:00,Cordula Standlake entered the Shadows.,117,The Fridays earned a Postseason Birth!,109
2246,19,98,2021-06-18 20:01:00+00:00,The Georgias earned a Postseason Birth!,109,The Georgias earned a Postseason Birth!,109
2247,19,98,2021-06-18 20:01:00+00:00,The Breath Mints earned a Postseason Birth!,109,The Breath Mints earned a Postseason Birth!,109
2248,19,98,2021-06-18 20:01:00+00:00,The Steaks earned a Postseason Birth!,109,The Steaks earned a Postseason Birth!,109
2249,19,98,2021-06-18 20:01:00+00:00,The Wild Wings earned a Postseason Birth!,109,The Wild Wings earned a Postseason Birth!,109
2250,19,98,2021-06-18 20:01:00+00:00,The Moist Talkers earned a Postseason Birth!,109,The Moist Talkers earned a Postseason Birth!,109
2251,19,98,2021-06-18 20:01:00+00:00,The Dale earned a Postseason Birth!,109,The Dale earned a Postseason Birth!,109
2252,19,98,2021-06-18 20:01:00+00:00,The Mechanics earned a Postseason Birth!,109,The Mechanics earned a Postseason Birth!,109
2253,19,98,2021-06-18 20:01:00+00:00,The Jazz Hands earned a Postseason Birth!,109,The Jazz Hands earned a Postseason Birth!,109
2254,19,98,2021-06-18 20:01:00+00:00,The Worms earned a Postseason Birth!,109,The Worms earned a Postseason Birth!,109
2255,19,98,2021-06-18 20:01:00+00:00,The Magic earned a Postseason Birth!,109,The Magic earned a Postseason Birth!,109
2256,19,98,2021-06-18 20:01:00+00:00,The Lift earned a Postseason Birth!,109,The Lift earned a Postseason Birth!,109
2257,19,98,2021-06-18 20:01:00+00:00,The Sunbeams earned a Postseason Birth!,109,The Sunbeams earned a Postseason Birth!,109
2258,19,98,2021-06-18 20:01:00+00:00,The Garages earned a Postseason Birth!,109,The Garages earned a Postseason Birth!,109
2259,19,98,2021-06-18 20:01:00+00:00,The Fridays earned a Postseason Birth!,109,The Fridays earned a Postseason Birth!,109
2260,19,98,2021-06-18 20:01:00+00:00,The Tacos earned a Postseason Birth!,109,The Tacos earned a Postseason Birth!,109
2261,19,98,2021-06-18 20:01:00+00:00,The Flowers earned a Postseason Birth!,109,The Flowers earned a Postseason Birth!,109
2262,19,98,2021-06-18 20:01:00+00:00,The Lovers earned a Postseason Birth!,109,The Lovers earned a Postseason Birth!,109
2263,19,98,2021-06-18 20:01:00+00:00,The Spies earned a Postseason Birth!,109,The Spies earned a Postseason Birth!,109
2264,19,98,2021-06-18 20:01:01+00:00,Stan Schenn entered the Shadows.,117,The Pies earned a Postseason Birth!,109
2265,19,98,2021-06-18 20:01:01+00:00,Dovydas Peeps entered the Shadows.,117,The Shoe Thieves earned a Postseason Birth!,109
2266,19,98,2021-06-18 20:01:01+00:00,The Shoe Thieves earned a Postseason Birth!,109,The Shoe Thieves earned a Postseason Birth!,109
2267,19,98,2021-06-18 20:01:01+00:00,The Pies earned a Postseason Birth!,109,The Pies earned a Postseason Birth!,109
2268,19,99,2021-06-18 21:24:20+00:00,"CONSUMERS ATTACK
SCATTERED
HALEXANDR-Y --LTON",118,"CONSUMERS ATTACK
SCATTERED
HALEXANDR-Y --LTON",67
2269,19,100,2021-06-18 22:03:01+00:00,"CONSUMERS ATTACK
VELASQUEZ ALSTOTT",118,"CONSUMERS ATTACK
VELASQUEZ ALSTOTT",67
2270,19,101,2021-06-18 23:21:35+00:00,Vernon Shotwell entered the Shadows.,117,"10 Runs collected.
Incoming Shadow Fax...
Vernon Shotwell is replaced by Oscar Dollie.",191
2271,19,103,2021-06-19 01:00:45+00:00,"CONSUMERS ATTACK
JAYDEN WRIGHT",118,"CONSUMERS ATTACK
JAYDEN WRIGHT",67
2272,19,107,2021-06-19 15:23:05+00:00,"CONSUMERS ATTACK
FITZGERALD BLACKBURN",118,"CONSUMERS ATTACK
FITZGERALD BLACKBURN",67
2273,19,110,2021-06-19 18:15:34+00:00,"CONSUMERS ATTACK
MATH VELAZQUEZ",118,"CONSUMERS ATTACK
MATH VELAZQUEZ",67
2274,19,114,2021-06-19 22:05:45+00:00,"CONSUMERS ATTACK
MATH VELAZQUEZ",118,"CONSUMERS ATTACK
MATH VELAZQUEZ",67
2275,19,115,2021-06-20 18:01:06+00:00,Hierophantic Foible entered the Shadows.,117,Will Received: Move,61
2276,19,115,2021-06-20 18:01:06+00:00,NaN entered the Shadows.,117,Will Received: Move,61
2277,19,115,2021-06-20 18:01:06+00:00,Yasslyn Statter Jr. entered the Shadows.,117,Will Received: Move,61
2278,19,115,2021-06-20 18:01:06+00:00,Cordula Standlake's Pitching is Infused.,117,Will Received: Shadow Infuse,61
2279,19,115,2021-06-20 18:01:06+00:00,Math Velazquez entered the Shadows.,117,Will Received: Move,61
2280,19,115,2021-06-20 18:01:06+00:00,Shirai McElroy entered the Shadows.,117,Will Received: Move,61
2281,19,115,2021-06-20 18:01:06+00:00,Gallup Crueller's Pitching is Infused.,117,Will Received: Shadow Infuse,61
2282,19,115,2021-06-20 18:01:06+00:00,Wyatt Mason IV entered the Shadows.,117,Will Received: Roster Swap,61
2283,19,115,2021-06-20 18:01:07+00:00,Lars Taylor's Defense is Infused.,117,Will Received: Shadow Infuse,61
2284,19,115,2021-06-20 18:01:07+00:00,Zippy DeShields entered the Shadows.,117,Will Received: Move,61
2285,19,115,2021-06-20 18:01:07+00:00,Usurper Violet entered the Shadows.,117,Will Received: Roster Swap,61
2286,19,115,2021-06-20 18:01:07+00:00,Tot Fox entered the Shadows.,117,Will Received: Roster Swap,61
2287,19,115,2021-06-20 18:01:07+00:00,Donna Milicic entered the Shadows.,117,Will Received: Move,61
2288,19,115,2021-06-20 18:01:07+00:00,Cornelius Games entered the Shadows.,117,Will Received: Roster Swap,61
2289,19,115,2021-06-20 18:01:07+00:00,Rivers Rosa entered the Shadows.,117,Will Received: Roster Swap,61
2290,19,115,2021-06-20 18:01:07+00:00,Pedro Davids entered the Shadows.,117,Will Received: Roster Swap,61
2291,19,115,2021-06-20 18:01:07+00:00,Grollis Zephyr entered the Shadows.,117,Will Received: Move,61
2292,19,115,2021-06-20 18:01:07+00:00,Kurt Crueller's Batting is Infused.,117,Will Received: Shadow Infuse,61
2293,19,115,2021-06-20 18:01:08+00:00,Scarlet Caster entered the Shadows.,117,Will Received: Roster Swap,61
2294,19,115,2021-06-20 18:01:08+00:00,Nickname Yamashita entered the Shadows.,117,Will Received: Move,61
2295,19,115,2021-06-20 18:01:10+00:00,Hiroto Wilcox's Alternate is called.,145,"Blessing Won: Couldn't Hurt, Tigers",60
2296,19,115,2021-06-20 18:01:10+00:00,Randy Castillo's Alternate is called.,145,"Blessing Won: Couldn't Hurt, Tigers",60
2297,19,115,2021-06-20 18:01:11+00:00,Steals Chark's Alternate is called.,145,"Blessing Won: Shots in the Dark, Georgias",60
2298,19,115,2021-06-20 18:01:11+00:00,Jon Tumblehome's Alternate is called.,145,"Blessing Won: Shots in the Dark, Georgias",60
2299,19,115,2021-06-20 18:01:11+00:00,Clementine Steeplechase's Alternate is called.,145,"Blessing Won: Shots in the Dark, Georgias",60
2300,19,115,2021-06-20 18:01:11+00:00,Neerie McCloud's Alternate is called.,145,"Blessing Won: Shots in the Dark, Georgias",60
2301,19,115,2021-06-20 18:01:11+00:00,Xandra Yolk's Alternate is called.,145,"Blessing Won: Shots in the Dark, Georgias",60
2302,20,2,2021-06-21 17:03:47+00:00,Knight Triumphant is Partying!,117,"Kline Greenlemon hits a 2-run home run!
Knight Triumphant is Partying!
Kline Greenlemon is Partying!",9
2303,20,2,2021-06-21 17:03:47+00:00,Kline Greenlemon is Partying!,117,"Kline Greenlemon hits a 2-run home run!
Knight Triumphant is Partying!
Kline Greenlemon is Partying!",9
2304,20,2,2021-06-21 17:17:54+00:00,Frankie Incarnate is Partying!,117,"Rai Spliff hits a Single!
Frankie Incarnate scores!
Frankie Incarnate is Partying!",10
2305,20,2,2021-06-21 17:18:59+00:00,Rai Spliff is Partying!,117,"Engine Eberhardt hits a grand slam!
Forrest Best is Partying!
Rai Spliff is Partying!
Cory Ross is Partying!
Engine Eberhardt is Partying!",9
2306,20,2,2021-06-21 17:18:59+00:00,Engine Eberhardt is Partying!,117,"Engine Eberhardt hits a grand slam!
Forrest Best is Partying!
Rai Spliff is Partying!
Cory Ross is Partying!
Engine Eberhardt is Partying!",9
2307,20,2,2021-06-21 17:18:59+00:00,Forrest Best is Partying!,117,"Engine Eberhardt hits a grand slam!
Forrest Best is Partying!
Rai Spliff is Partying!
Cory Ross is Partying!
Engine Eberhardt is Partying!",9
2308,20,2,2021-06-21 17:18:59+00:00,Cory Ross is Partying!,117,"Engine Eberhardt hits a grand slam!
Forrest Best is Partying!
Rai Spliff is Partying!
Cory Ross is Partying!
Engine Eberhardt is Partying!",9
2309,20,5,2021-06-21 20:18:06+00:00,Cory Ross is Partying!,117,"Engine Eberhardt hits a Double!
Cory Ross scores!
Cory Ross is Partying!",10
2310,20,5,2021-06-21 20:20:17+00:00,Richardson Games is Partying!,117,"Richardson Games steals fourth base!
Richardson Games is Partying!",4
2311,20,6,2021-06-21 21:12:15+00:00,Tot Clark is Partying!,117,"Tot Clark hits a solo home run!
Tot Clark is Partying!",9
2312,20,6,2021-06-21 21:13:35+00:00,Oliver Notarobot is Partying!,117,"Malik Destiny hits a Single!
Oliver Notarobot scores!
Oliver Notarobot is Partying!",10
2313,20,6,2021-06-21 21:13:55+00:00,Lotus Mango is Partying!,117,"Emblem Warhorse hits a Single!
Lotus Mango scores!
Lotus Mango is Partying!",10
2314,20,10,2021-06-22 01:20:35+00:00,Felix Garbage is Partying!,117,"Felix Garbage hits a solo home run!
Felix Garbage is Partying!",9
2315,20,10,2021-06-22 01:22:01+00:00,Kaz Fiasco is Partying!,117,"Kaz Fiasco hits a solo home run!
Kaz Fiasco is Partying!",9
2316,20,11,2021-06-22 02:11:11+00:00,Steals Mondegreen replaced the incinerated Gerund Pantheocide.,116,"Rogue Umpire incinerated Gerund Pantheocide!
They're replaced by Steals Mondegreen.",54
2317,20,11,2021-06-22 02:24:06+00:00,Alexandria Rosales entered the Shadows.,117,"10 Runs collected.
Incoming Shadow Fax...
Alexandria Rosales is replaced by Plums Blather.",191
2318,20,12,2021-06-22 03:22:10+00:00,Conrad Vaughan entered the Shadows.,117,"10 Runs collected.
Incoming Shadow Fax...
Conrad Vaughan is replaced by Theodore Cervantes.",191
2319,20,15,2021-06-22 06:07:15+00:00,Geraldine Frost is Partying!,117,"Flattery McKinley hits a Triple!
Geraldine Frost scores!
Geraldine Frost is Partying!",10
2320,20,15,2021-06-22 06:29:49+00:00,Plums Blather entered the Shadows.,117,"10 Runs collected.
Incoming Shadow Fax...
Plums Blather is replaced by Alexandria Rosales.",191
2321,20,16,2021-06-22 07:24:30+00:00,Beans McBlase entered the Shadows.,117,"10 Runs collected.
Incoming Shadow Fax...
Beans McBlase is replaced by Lucy Tokkan.",191
2322,20,18,2021-06-22 09:27:39+00:00,Fish Summer is Partying!,117,"Fish Summer hits a solo home run!
Fish Summer is Partying!",9
2323,20,18,2021-06-22 09:28:19+00:00,Ayanna Dumpington is Partying!,117,"-at--o T----ph--t out at second base.
Ayanna Dumpington scores!
Zion Aliciakeyes reaches on fielder's choice.
Ayanna Dumpington is Partying!",8
2324,20,20,2021-06-22 11:12:26+00:00,Mint Shupe re-congealed differently.,117,Mint Shupe returned from Elsewhere after 1 day!,84
2325,20,23,2021-06-22 14:03:03+00:00,Kichiro Guerra is Partying!,117,"Millipede Aqualuft hits a Single!
Kichiro Guerra scores!
Kichiro Guerra is Partying!",10
2326,20,23,2021-06-22 14:04:08+00:00,Millipede Aqualuft is Partying!,117,"Pudge Nakamoto hits a Single!
Millipede Aqualuft scores!
Millipede Aqualuft is Partying!",10
2327,20,23,2021-06-22 14:05:43+00:00,Rat Mason is Partying!,117,"Basilio Mason hit a flyout to Kichiro Guerra.
Rat Mason tags up and scores!
Rat Mason is Partying!",7
2328,20,23,2021-06-22 14:06:38+00:00,Basilio Fig is Partying!,117,"Fish Summer hit a flyout to Farrell Seagull.
Basilio Fig tags up and scores!
Basilio Fig is Partying!",7
2329,20,24,2021-06-22 15:03:28+00:00,Logan Rodriguez is Partying!,117,"Jesús Koch hits a Triple!
Logan Rodriguez scores!
Eizabeth Elliott scores!
Logan Rodriguez is Partying!
Eizabeth Elliott is Partying!",10
2330,20,24,2021-06-22 15:03:28+00:00,Eizabeth Elliott is Partying!,117,"Jesús Koch hits a Triple!
Logan Rodriguez scores!
Eizabeth Elliott scores!
Logan Rodriguez is Partying!
Eizabeth Elliott is Partying!",10
2331,20,24,2021-06-22 15:03:48+00:00,Jesús Koch is Partying!,117,"Wyatt Glover hit a ground out to Kennedy Loser.
Jesús Koch advances on the sacrifice.
Jesús Koch is Partying!",8
2332,20,24,2021-06-22 15:14:36+00:00,Commissioner Vapor is Partying!,117,"Siobhan Chark hits a Single!
Commissioner Vapor scores!
Commissioner Vapor is Partying!",10
2333,20,24,2021-06-22 15:23:22+00:00,Eugenia Bickle is Partying!,117,"Paula Reddick hit a ground out to -at--o T----pha-t.
Eugenia Bickle advances on the sacrifice.
Eugenia Bickle is Partying!",8
2334,20,26,2021-06-22 17:19:19+00:00,Leach Ingram entered the Shadows.,117,"10 Runs collected.
Incoming Shadow Fax...
Leach Ingram is replaced by Lucas Petty.",191
2335,20,26,2021-06-22 17:23:46+00:00,Fish Summer is Partying!,117,"Felix Garbage hits a Triple!
Fish Summer scores!
Fish Summer is Partying!",10
2336,20,26,2021-06-22 17:24:05+00:00,Felix Garbage is Partying!,117,"Sexton Wheerer hits a Single!
Felix Garbage scores!
Felix Garbage is Partying!",10
2337,20,26,2021-06-22 17:24:45+00:00,Sexton Wheerer is Partying!,117,"Rat Mason hits a Single!
Sexton Wheerer scores!
Sexton Wheerer is Partying!",10
2338,20,30,2021-06-22 22:20:53+00:00,Jan Canberra entered the Shadows.,117,"10 Runs collected.
Incoming Shadow Fax...
Jan Canberra is replaced by Goobie Ballson.",191
2339,20,31,2021-06-22 23:13:26+00:00,"CONSUMERS ATTACK
SCORES BASERUNNER",118,"CONSUMERS ATTACK
SCORES BASERUNNER",67
2340,20,35,2021-06-23 03:22:19+00:00,Oliver Loofah entered the Shadows.,117,"10 Runs collected.
Incoming Shadow Fax...
Oliver Loofah is replaced by Summers Pony.",191
2341,20,41,2021-06-23 09:21:43+00:00,"CONSUMERS ATTACK
THOMAS DRACAENA",118,"CONSUMERS ATTACK
THOMAS DRACAENA",67
2342,20,42,2021-06-23 10:24:25+00:00,"CONSUMERS ATTACK
FITZGERALD BLACKBURN",118,"CONSUMERS ATTACK
FITZGERALD BLACKBURN",67
2343,20,43,2021-06-23 11:24:21+00:00,Mags Banananana entered the Shadows.,117,"10 Runs collected.
Incoming Shadow Fax...
Mags Banananana is replaced by Domino Bootleg.",191
2344,20,44,2021-06-23 12:24:40+00:00,Amos Melon entered the Shadows.,117,"10 Runs collected.
Incoming Shadow Fax...
Amos Melon is replaced by Cudi Di Batterino.",191
2345,20,51,2021-06-23 19:02:28+00:00,"CONSUMERS ATTACK
HAHN FOX",118,"CONSUMERS ATTACK
HAHN FOX",67
2346,20,51,2021-06-23 19:26:26+00:00,Kennedy Rodgers entered the Shadows.,117,"10 Runs collected.
Incoming Shadow Fax...
Kennedy Rodgers is replaced by Zi Sliders.",191
2347,20,56,2021-06-24 00:22:04+00:00,Betsy Trombone entered the Shadows.,117,"10 Runs collected.
Incoming Shadow Fax...
Betsy Trombone is replaced by Fairwood Patchwork.",191
2348,20,69,2021-06-24 13:00:59+00:00,"CONSUMERS ATTACK
CHORBY SHORT",118,"CONSUMERS ATTACK
CHORBY SHORT",67
2349,20,70,2021-06-24 14:12:57+00:00,"CONSUMERS ATTACK
ZESTY YABOI",118,"CONSUMERS ATTACK
ZESTY YABOI",67
2350,20,71,2021-06-24 15:20:56+00:00,Axel Campbell entered the Shadows.,117,"10 Runs collected.
Incoming Shadow Fax...
Axel Campbell is replaced by Finn James.",191
2351,20,72,2021-06-24 17:36:45+00:00,Terrell Bradley entered the Shadows.,117,"Home Team Shutout.
Incoming Voicemail...
Terrell Bradley is replaced by Vernon Shotwell.",228
2352,20,73,2021-06-24 18:26:59+00:00,"CONSUMERS ATTACK
COMMISSIONER VAPOR",118,"CONSUMERS ATTACK
COMMISSIONER VAPOR",67
2353,20,74,2021-06-24 19:25:54+00:00,Caleb Novak entered the Shadows.,117,"Home Team Shutout.
Incoming Voicemail...
Caleb Novak is replaced by Tad Seeth.",228
2354,20,75,2021-06-24 20:03:11+00:00,"CONSUMERS ATTACK
BOBBIN MOSS",118,"CONSUMERS ATTACK
BOBBIN MOSS",67
2355,20,75,2021-06-24 20:18:51+00:00,Domino Bootleg entered the Shadows.,117,"10 Runs collected.
Incoming Shadow Fax...
Domino Bootleg is replaced by Silvaire Semiquaver.",191
2356,20,75,2021-06-24 20:27:54+00:00,"CONSUMERS ATTACK
HENRY MARSHALLOW",118,"CONSUMERS ATTACK
HENRY MARSHALLOW",67
2357,20,75,2021-06-24 20:33:20+00:00,Jayden Wright entered the Shadows.,117,"10 Runs collected.
Incoming Shadow Fax...
Jayden Wright is replaced by Harriet Gildehaus.",191
2358,20,75,2021-06-24 20:35:26+00:00,-y--- --Lan--rn entered the Shadows.,117,"Home Team Shutout.
Incoming Voicemail...
-y--- --Lan--rn is replaced by Grollis Zephyr.",228
2359,20,76,2021-06-24 21:11:41+00:00,Axel Cardenas entered the Shadows.,117,"10 Runs collected.
Incoming Shadow Fax...
Axel Cardenas is replaced by Rafael Davids.",191
2360,20,76,2021-06-24 21:16:54+00:00,"CONSUMERS ATTACK
TRINITY SMAHT",118,"CONSUMERS ATTACK
TRINITY SMAHT",67
2361,20,76,2021-06-24 21:23:44+00:00,Zi Sliders entered the Shadows.,117,"10 Runs collected.
Incoming Shadow Fax...
Zi Sliders is replaced by Alston England.",191
2362,20,76,2021-06-24 21:26:05+00:00,Steals Mondegreen entered the Shadows.,117,"Home Team Shutout.
Incoming Voicemail...
Steals Mondegreen is replaced by Theodore Honeywell.",228
2363,20,76,2021-06-24 21:28:35+00:00,Patty Fox entered the Shadows.,117,"10 Runs collected.
Incoming Shadow Fax...
Patty Fox is replaced by Conrad Vaughan.",191
2364,20,76,2021-06-24 21:36:49+00:00,Rafael Davids entered the Shadows.,117,"10 Runs collected.
Incoming Shadow Fax...
Rafael Davids is replaced by Joshua Watson.",191
2365,20,77,2021-06-24 22:14:48+00:00,"CONSUMERS ATTACK
RIVERS CLEMBONS",118,"CONSUMERS ATTACK
RIVERS CLEMBONS",67
2366,20,77,2021-06-24 22:22:55+00:00,Anathema Elemefayo entered the Shadows.,117,"Home Team Shutout.
Incoming Voicemail...
Anathema Elemefayo is replaced by Patty Fox.",228
2367,20,77,2021-06-24 22:23:17+00:00,Coolname Galvanic entered the Shadows.,117,"10 Runs collected.
Incoming Shadow Fax...
Coolname Galvanic is replaced by Domino Bootleg.",191
2368,20,78,2021-06-24 23:14:35+00:00,Goobie Ballson entered the Shadows.,117,"10 Runs collected.
Incoming Shadow Fax...
Goobie Ballson is replaced by Jan Canberra.",191
2369,20,78,2021-06-24 23:21:00+00:00,Lucas Petty entered the Shadows.,117,"10 Runs collected.
Incoming Shadow Fax...
Lucas Petty is replaced by Leach Ingram.",191
2370,20,78,2021-06-24 23:25:06+00:00,Emblem Warhorse entered the Shadows.,117,"Home Team Shutout.
Incoming Voicemail...
Emblem Warhorse is replaced by Oliver Loofah.",228
2371,20,79,2021-06-25 00:21:08+00:00,Ortiz Lopez entered the Shadows.,117,"10 Runs collected.
Incoming Shadow Fax...
Ortiz Lopez is replaced by Goobie Ballson.",191
2372,20,79,2021-06-25 00:22:30+00:00,Lenjamin Zhuge is Partying!,117,"Lenjamin Zhuge is Partying!
A flock of Birds are attracted to The Big Garage!",24
2373,20,79,2021-06-25 00:23:45+00:00,Yeong-Ho Garcia entered the Shadows.,117,"Home Team Shutout.
Incoming Voicemail...
Yeong-Ho Garcia is replaced by Math Velazquez.",228
2374,20,79,2021-06-25 00:24:20+00:00,Oliver Loofah is Partying!,117,"Oliver Loofah is Partying!
A flock of Birds are attracted to The Big Garage!",24
2375,20,80,2021-06-25 01:02:45+00:00,"CONSUMERS ATTACK
PHINEAS WORMTHRICE",118,"CONSUMERS ATTACK
PHINEAS WORMTHRICE",67
2376,20,80,2021-06-25 01:15:47+00:00,Leach Ingram entered the Shadows.,117,"10 Runs collected.
Incoming Shadow Fax...
Leach Ingram is replaced by Lucas Petty.",191
2377,20,80,2021-06-25 01:20:21+00:00,Fairwood Patchwork entered the Shadows.,117,"10 Runs collected.
Incoming Shadow Fax...
Fairwood Patchwork is replaced by Mcdowell Karim.",191
2378,20,80,2021-06-25 01:29:40+00:00,Logan Rodriguez entered the Shadows.,117,"Home Team Shutout.
Incoming Voicemail...
Logan Rodriguez is replaced by Washer Barajas.",228
2379,20,81,2021-06-25 02:21:29+00:00,Conrad Vaughan entered the Shadows.,117,"10 Runs collected.
Incoming Shadow Fax...
Conrad Vaughan is replaced by Anathema Elemefayo.",191
2380,20,81,2021-06-25 02:21:35+00:00,Mikan Ha-m-r entered the Shadows.,117,"Home Team Shutout.
Incoming Voicemail...
Mikan Ha-m-r is replaced by Spears Rogers.",228
2381,20,81,2021-06-25 02:23:14+00:00,Sandie Turner entered the Shadows.,117,"Home Team Shutout.
Incoming Voicemail...
Sandie Turner is replaced by Conrad Vaughan.",228
2382,20,81,2021-06-25 02:29:50+00:00,"CONSUMERS ATTACK
FORREST BEST",118,"CONSUMERS ATTACK
FORREST BEST",67
2383,20,82,2021-06-25 03:26:58+00:00,Brock Watson is Partying!,117,"Brock Watson is Partying!
A flock of Birds are attracted to The Bucket!",24
2384,20,82,2021-06-25 03:29:24+00:00,Rodriguez Internet is Partying!,117,"Rodriguez Internet is Partying!
A flock of Birds are attracted to The Meadow!",24
2385,20,82,2021-06-25 03:30:24+00:00,Joshua Watson is Partying!,117,"Joshua Watson is Partying!
A flock of Birds are attracted to The Bucket!",24
2386,20,82,2021-06-25 03:31:34+00:00,Evelton McBlase II is Partying!,117,"Evelton McBlase II is Partying!
A flock of Birds are attracted to The Bucket!",24
2387,20,83,2021-06-25 05:04:59+00:00,"CONSUMERS ATTACK
RIVERS CLEMBONS",118,"CONSUMERS ATTACK
RIVERS CLEMBONS",67
2388,20,83,2021-06-25 05:23:51+00:00,Kina Larsen entered the Shadows.,117,"Home Team Shutout.
Incoming Voicemail...
Kina Larsen is replaced by Leach Ingram.",228
2389,20,84,2021-06-25 06:01:09+00:00,Sosa Hayes is Partying!,117,"Sosa Hayes is Partying!
A flock of Birds are attracted to The Garden!",24
2390,20,84,2021-06-25 06:02:55+00:00,Liquid Friend III is Partying!,117,"Liquid Friend III is Partying!
A flock of Birds are attracted to The Steakhouse!",24
2391,20,84,2021-06-25 06:03:19+00:00,Foxy Pebble is Partying!,117,"Foxy Pebble is Partying!
A flock of Birds are attracted to The Pocket!",24
2392,20,84,2021-06-25 06:03:39+00:00,Jan Canberra is Partying!,117,"Jan Canberra is Partying!
A flock of Birds are attracted to The Garden!",24
2393,20,84,2021-06-25 06:06:14+00:00,Chorby Soul V is Partying!,117,"Chorby Soul V is Partying!
A flock of Birds are attracted to The Garden!",24
2394,20,84,2021-06-25 06:06:35+00:00,Grollis Zephyr is Partying!,117,"Grollis Zephyr is Partying!
A flock of Birds are attracted to The Gym!",24
2395,20,84,2021-06-25 06:06:45+00:00,Jessica Telephone is Partying!,117,"Jessica Telephone is Partying!
A flock of Birds are attracted to The Steakhouse!",24
2396,20,84,2021-06-25 06:10:35+00:00,Sosa Hayes is Partying!,117,"Sosa Hayes is Partying!
A flock of Birds are attracted to The Garden!",24
2397,20,85,2021-06-25 07:01:48+00:00,Theodore Honeywell is Partying!,117,"Theodore Honeywell is Partying!
A flock of Birds are attracted to The Gym!",24
2398,20,85,2021-06-25 07:05:53+00:00,Jomgy Rolsenthal is Partying!,117,"Jomgy Rolsenthal is Partying!
A flock of Birds are attracted to The Gym!",24
2399,20,85,2021-06-25 07:09:05+00:00,Uncle Plasma IV is Partying!,117,"Uncle Plasma IV is Partying!
A flock of Birds are attracted to The Pocket!",24
2400,20,85,2021-06-25 07:11:09+00:00,Wyatt Mason X is Partying!,117,"Wyatt Mason X is Partying!
A flock of Birds are attracted to The Big Garage!",24
