,season,day,timestamp,description,event_type,parent_description,parent_event_type
1127,15,89,2021-04-16 12:14:18+00:00,Silvaire Semiquaver is Partying!,117,Silvaire Semiquaver is Partying!,24
1128,15,89,2021-04-16 12:15:08+00:00,Wichita Toaster is Partying!,117,Wichita Toaster is Partying!,24
1129,15,89,2021-04-16 12:15:59+00:00,Mordecai Kingbird is Partying!,117,Mordecai Kingbird is Partying!,24
1130,15,89,2021-04-16 12:21:24+00:00,Elwin McGhee is Partying!,117,Elwin McGhee is Partying!,24
1131,15,89,2021-04-16 12:21:25+00:00,Burke Gonzales is Partying!,117,Burke Gonzales is Partying!,24
1132,15,89,2021-04-16 12:25:10+00:00,Howell Franklin is Partying!,117,Howell Franklin is Partying!,24
1133,15,90,2021-04-16 13:08:52+00:00,Halexandrey Walton is Partying!,117,Halexandrey Walton is Partying!,24
1134,15,90,2021-04-16 13:14:44+00:00,Gerund Pantheocide is Partying!,117,Gerund Pantheocide is Partying!,24
1135,15,90,2021-04-16 13:18:03+00:00,Velasquez Alstott is Partying!,117,Velasquez Alstott is Partying!,24
1136,15,91,2021-04-16 14:01:36+00:00,Sparks Beans is Partying!,117,Sparks Beans is Partying!,24
1137,15,91,2021-04-16 14:07:17+00:00,Mikan Hammer is Partying!,117,Mikan Hammer is Partying!,24
1138,15,91,2021-04-16 14:08:27+00:00,Anathema Elemefayo replaced the incinerated Winnie Mccall.,116,"Rogue Umpire incinerated Winnie Mccall!
They're replaced by Anathema Elemefayo.",54
1139,15,91,2021-04-16 14:19:26+00:00,Cannonball Sports is Partying!,117,Cannonball Sports is Partying!,24
1140,15,92,2021-04-16 15:12:32+00:00,Dervin Gorczyca is Partying!,117,Dervin Gorczyca is Partying!,24
1141,15,92,2021-04-16 15:18:08+00:00,Frankie Hambone is Partying!,117,Frankie Hambone is Partying!,24
1142,15,92,2021-04-16 15:20:13+00:00,Jordan Hildebert is Partying!,117,Jordan Hildebert is Partying!,24
1143,15,92,2021-04-16 15:23:49+00:00,Hahn Fox is Partying!,117,Hahn Fox is Partying!,24
1144,15,92,2021-04-16 15:25:24+00:00,Walton Sports is Partying!,117,Walton Sports is Partying!,24
1145,15,93,2021-04-16 16:00:21+00:00,Walton Sports is Partying!,117,Walton Sports is Partying!,24
1146,15,93,2021-04-16 16:01:06+00:00,Lotus Mango is Partying!,117,Lotus Mango is Partying!,24
1147,15,93,2021-04-16 16:07:02+00:00,Silvaire Roadhouse is Partying!,117,Silvaire Roadhouse is Partying!,24
1148,15,93,2021-04-16 16:07:08+00:00,Logan Horseman is Partying!,117,Logan Horseman is Partying!,24
1149,15,94,2021-04-16 17:08:58+00:00,Dervin Gorczyca is Partying!,117,Dervin Gorczyca is Partying!,24
1150,15,94,2021-04-16 17:11:37+00:00,Jordan Hildebert is Partying!,117,Jordan Hildebert is Partying!,24
1151,15,94,2021-04-16 17:11:52+00:00,Scores Baserunner is Partying!,117,Scores Baserunner is Partying!,24
1152,15,94,2021-04-16 17:12:48+00:00,Stijn Strongbody is Partying!,117,Stijn Strongbody is Partying!,24
1153,15,94,2021-04-16 17:16:42+00:00,Richardson Games is Partying!,117,Richardson Games is Partying!,24
1154,15,94,2021-04-16 17:26:54+00:00,Tot Clark is Partying!,117,Tot Clark is Partying!,24
1155,15,95,2021-04-16 18:05:22+00:00,Adalberto Tosser is Partying!,117,Adalberto Tosser is Partying!,24
1156,15,95,2021-04-16 18:15:33+00:00,Grollis Zephyr is Partying!,117,Grollis Zephyr is Partying!,24
1157,15,95,2021-04-16 18:17:20+00:00,Jasmine Washington is Partying!,117,Jasmine Washington is Partying!,24
1158,15,95,2021-04-16 18:17:54+00:00,Cannonball Sports is Partying!,117,Cannonball Sports is Partying!,24
1159,15,96,2021-04-16 19:00:41+00:00,Rigby Friedrich is Partying!,117,Rigby Friedrich is Partying!,24
1160,15,96,2021-04-16 19:01:06+00:00,Nicholas Mora is Partying!,117,Nicholas Mora is Partying!,24
1161,15,96,2021-04-16 19:03:11+00:00,Malik Destiny is Partying!,117,Malik Destiny is Partying!,24
1162,15,96,2021-04-16 19:07:28+00:00,Rigby Friedrich is Partying!,117,Rigby Friedrich is Partying!,24
1163,15,96,2021-04-16 19:08:22+00:00,Alexander Horne is Partying!,117,Alexander Horne is Partying!,24
1164,15,96,2021-04-16 19:09:28+00:00,Silvaire Roadhouse is Partying!,117,Silvaire Roadhouse is Partying!,24
1165,15,96,2021-04-16 19:11:21+00:00,Spears Taylor is Partying!,117,Spears Taylor is Partying!,24
1166,15,96,2021-04-16 19:12:14+00:00,Randy Dennis is Partying!,117,Randy Dennis is Partying!,24
1167,15,96,2021-04-16 19:14:03+00:00,Ortiz Lopez is Partying!,117,Ortiz Lopez is Partying!,24
1168,15,96,2021-04-16 19:16:07+00:00,Snyder Briggs is Partying!,117,Snyder Briggs is Partying!,24
1169,15,96,2021-04-16 19:17:20+00:00,Miguel James is Partying!,117,Miguel James is Partying!,24
1170,15,96,2021-04-16 19:22:27+00:00,Theodore Cervantes is Partying!,117,Theodore Cervantes is Partying!,24
1171,15,96,2021-04-16 19:23:58+00:00,Cannonball Sports is Partying!,117,Cannonball Sports is Partying!,24
1172,15,96,2021-04-16 19:26:34+00:00,King Roland is Partying!,117,King Roland is Partying!,24
1173,15,96,2021-04-16 19:26:39+00:00,Halexandrey Walton is Partying!,117,Halexandrey Walton is Partying!,24
1174,15,96,2021-04-16 19:28:35+00:00,Kennedy Loser is Partying!,117,Kennedy Loser is Partying!,24
1175,15,96,2021-04-16 19:31:15+00:00,Oliver Loofah is Partying!,117,Oliver Loofah is Partying!,24
1176,15,97,2021-04-16 20:00:16+00:00,Howell Rocha is Partying!,117,Howell Rocha is Partying!,24
1177,15,97,2021-04-16 20:00:36+00:00,Nandy Fantastic is Partying!,117,Nandy Fantastic is Partying!,24
1178,15,97,2021-04-16 20:02:56+00:00,Cory Twelve is Partying!,117,Cory Twelve is Partying!,24
1179,15,97,2021-04-16 20:04:01+00:00,Rafael Davids is Partying!,117,Rafael Davids is Partying!,24
1180,15,97,2021-04-16 20:05:06+00:00,Bates Bentley is Partying!,117,Bates Bentley is Partying!,24
1181,15,97,2021-04-16 20:06:52+00:00,Oscar Vaughan is Partying!,117,Oscar Vaughan is Partying!,24
1182,15,97,2021-04-16 20:14:49+00:00,Thomas Dracaena is Partying!,117,Thomas Dracaena is Partying!,24
1183,15,97,2021-04-16 20:16:19+00:00,Randy Dennis is Partying!,117,Randy Dennis is Partying!,24
1184,15,97,2021-04-16 20:17:59+00:00,Montgomery Bullock is Partying!,117,Montgomery Bullock is Partying!,24
1185,15,97,2021-04-16 20:20:20+00:00,Ayanna Dumpington is Partying!,117,Ayanna Dumpington is Partying!,24
1186,15,97,2021-04-16 20:21:05+00:00,Liam Snail is Partying!,117,Liam Snail is Partying!,24
1187,15,97,2021-04-16 20:24:20+00:00,Paula Mason is Partying!,117,Paula Mason is Partying!,24
1188,15,97,2021-04-16 20:30:11+00:00,Elvis Figueroa is Partying!,117,Elvis Figueroa is Partying!,24
1189,15,98,2021-04-16 21:01:16+00:00,Rigby Friedrich is Partying!,117,Rigby Friedrich is Partying!,24
1190,15,98,2021-04-16 21:10:18+00:00,Don Mitchell is Partying!,117,Don Mitchell is Partying!,24
1191,15,98,2021-04-16 21:11:03+00:00,Slosh Truk is Partying!,117,Slosh Truk is Partying!,24
1192,15,98,2021-04-16 21:11:23+00:00,Tot Clark is Partying!,117,Tot Clark is Partying!,24
1193,15,98,2021-04-16 21:14:10+00:00,Cannonball Sports is Partying!,117,Cannonball Sports is Partying!,24
1194,15,98,2021-04-16 21:16:23+00:00,Burke Gonzales is Partying!,117,Burke Gonzales is Partying!,24
1195,15,98,2021-04-16 21:18:41+00:00,Freemium Seraph is Partying!,117,Freemium Seraph is Partying!,24
1196,15,98,2021-04-16 21:21:16+00:00,Helga Moreno is Partying!,117,Helga Moreno is Partying!,24
1197,15,98,2021-04-16 21:28:06+00:00,Cory Twelve is Partying!,117,Cory Twelve is Partying!,24
1198,15,98,2021-04-16 22:01:00+00:00,The Shoe Thieves earn a Postseason Birth!,109,The Shoe Thieves earn a Postseason Birth!,109
1199,15,98,2021-04-16 22:01:00+00:00,The Spies earn a Postseason Birth!,109,The Spies earn a Postseason Birth!,109
1200,15,98,2021-04-16 22:01:00+00:00,The Tigers earn a Postseason Birth!,109,The Tigers earn a Postseason Birth!,109
1201,15,98,2021-04-16 22:01:00+00:00,The Tacos earn a Postseason Birth!,109,The Tacos earn a Postseason Birth!,109
1202,15,98,2021-04-16 22:01:00+00:00,The Firefighters earn a Postseason Birth!,109,The Firefighters earn a Postseason Birth!,109
1203,15,98,2021-04-16 22:01:00+00:00,The Moist Talkers earn a Postseason Birth!,109,The Moist Talkers earn a Postseason Birth!,109
1204,15,98,2021-04-16 22:01:00+00:00,The Worms earn a Postseason Birth!,109,The Worms earn a Postseason Birth!,109
1205,15,98,2021-04-16 22:01:00+00:00,The Steaks earn a Postseason Birth!,109,The Steaks earn a Postseason Birth!,109
1206,15,98,2021-04-16 22:01:00+00:00,The Breath Mints earn a Postseason Birth!,109,The Breath Mints earn a Postseason Birth!,109
1207,15,98,2021-04-16 22:01:00+00:00,The Mechanics earn a Postseason Birth!,109,The Mechanics earn a Postseason Birth!,109
1208,15,99,2021-04-16 23:14:51+00:00,"CONSUMERS ATTACK
DUNLAP FIGUEROA",118,"CONSUMERS ATTACK
DUNLAP FIGUEROA",67
1209,15,116,2021-04-17 23:22:47+00:00,"CONSUMERS ATTACK
RAI SPLIFF",118,"CONSUMERS ATTACK
RAI SPLIFF",67
1210,15,116,2021-04-18 18:01:04+00:00,Patchwork Southwick's Pitching is Infused.,117,Will Received: Transfuse,61
1211,15,116,2021-04-18 18:01:04+00:00,Rat Mason's Batting is Infused.,117,Will Received: Transfuse,61
1212,15,116,2021-04-18 18:01:04+00:00,Patchwork Southwick's Defense is Outfused.,118,Will Received: Transfuse,61
1213,15,116,2021-04-18 18:01:04+00:00,Zack Sanders' Batting is Outfused.,118,Will Received: Transfuse,61
1214,15,116,2021-04-18 18:01:04+00:00,Eizabeth Guerra entered the Shadows.,117,Will Received: Move,61
1215,15,116,2021-04-18 18:01:04+00:00,PolkaDot Patterson's Alternate is called.,145,Will Received: Alternate Trust,61
1216,15,116,2021-04-18 18:01:04+00:00,Margarito Nava entered the Shadows.,117,Will Received: Plunder,61
1217,15,116,2021-04-18 18:01:04+00:00,Mira Lemma's Baserunning is Outfused.,118,Will Received: Transfuse,61
1218,15,116,2021-04-18 18:01:04+00:00,Becker Solis entered the Shadows.,117,Will Received: Move,61
1219,15,116,2021-04-18 18:01:04+00:00,Orville Manco's Defense is Outfused.,118,Will Received: Transfuse,61
1220,15,116,2021-04-18 18:01:04+00:00,Becker Solis' Pitching is Infused.,117,Will Received: Transfuse,61
1221,15,116,2021-04-18 18:01:04+00:00,Cantus Hojo entered the Shadows.,117,Will Received: Move,61
1222,15,116,2021-04-18 18:01:04+00:00,Orville Manco's Pitching is Infused.,117,Will Received: Transfuse,61
1223,15,116,2021-04-18 18:01:04+00:00,Rat Mason's Defense is Outfused.,118,Will Received: Transfuse,61
1224,15,116,2021-04-18 18:01:04+00:00,Rodriguez Internet's Pitching is Outfused.,118,Will Received: Transfuse,61
1225,15,116,2021-04-18 18:01:04+00:00,Becker Solis' Defense is Outfused.,118,Will Received: Transfuse,61
1226,15,116,2021-04-18 18:01:04+00:00,Rodriguez Internet's Batting is Infused.,117,Will Received: Transfuse,61
1227,15,116,2021-04-18 18:01:04+00:00,Francisco Presto- entered the Shadows.,117,Will Received: Foreshadow,61
1228,15,116,2021-04-18 18:01:04+00:00,Dunlap Figueroa's Pitching is Infused.,117,Will Received: Transfuse,61
1229,15,116,2021-04-18 18:01:04+00:00,Zack Sanders' Pitching is Infused.,117,Will Received: Transfuse,61
1230,15,116,2021-04-18 18:01:04+00:00,Fenry Marlow's Pitching is Infused.,117,Will Received: Transfuse,61
1231,15,116,2021-04-18 18:01:04+00:00,Dunlap Figueroa's Baserunning is Outfused.,118,Will Received: Transfuse,61
1232,15,116,2021-04-18 18:01:04+00:00,Fenry Marlow's Batting is Outfused.,118,Will Received: Transfuse,61
1233,15,116,2021-04-18 18:01:04+00:00,Sixpack Dogwalker entered the Shadows.,117,Will Received: Foreshadow,61
1234,15,116,2021-04-18 18:01:04+00:00,Socks Maybe's Alternate is called.,145,Will Received: Alternate Trust,61
1235,15,116,2021-04-18 18:01:04+00:00,Mira Lemma's Batting is Infused.,117,Will Received: Transfuse,61
1236,15,116,2021-04-18 18:01:05+00:00,Logan Horseman's Batting is Infused.,117,Will Received: Transfuse,61
1237,15,116,2021-04-18 18:01:05+00:00,Elijah Valenzuela's Alternate is called.,145,Will Received: Alternate Trust,61
1238,15,116,2021-04-18 18:01:05+00:00,Silvia Rugrat's Defense is Outfused.,118,Will Received: Transfuse,61
1239,15,116,2021-04-18 18:01:05+00:00,Alaynabella Hollywood entered the Shadows.,117,Will Received: Foreshadow,61
1240,15,116,2021-04-18 18:01:05+00:00,Elijah Valenzuela's Batting is Infused.,117,Will Received: Transfuse,61
1241,15,116,2021-04-18 18:01:05+00:00,Alston Cerveza entered the Shadows.,117,Will Received: Foreshadow,61
1242,15,116,2021-04-18 18:01:05+00:00,D-n Ell--tt entered the Shadows.,117,Will Received: Foreshadow,61
1243,15,116,2021-04-18 18:01:05+00:00,Logan Horseman's Defense is Outfused.,118,Will Received: Transfuse,61
1244,15,116,2021-04-18 18:01:05+00:00,Patty Fox's Pitching is Infused.,117,Will Received: Transfuse,61
1245,15,116,2021-04-18 18:01:05+00:00,Roscoe Sundae entered the Shadows.,117,Will Received: Move,61
1246,15,116,2021-04-18 18:01:05+00:00,Silvia Rugrat's Pitching is Infused.,117,Will Received: Transfuse,61
1247,15,116,2021-04-18 18:01:05+00:00,Patty Fox's Baserunning is Outfused.,118,Will Received: Transfuse,61
1248,15,116,2021-04-18 18:01:05+00:00,Elijah Valenzuela's Defense is Outfused.,118,Will Received: Transfuse,61
1249,15,116,2021-04-18 18:01:05+00:00,Dudley Mueller entered the Shadows.,117,Will Received: Foreshadow,61
1250,15,116,2021-04-18 18:01:05+00:00,Oscar Vaughan entered the Shadows.,117,Will Received: Foreshadow,61
1251,15,116,2021-04-18 18:01:46+00:00,Kit Ratoon's hitting was boosted.,117,"Blessing Won: Shadow Batting Practice, Worms",60
1252,15,116,2021-04-18 18:01:46+00:00,Dulce Schofield's hitting was boosted.,117,"Blessing Won: Shadow Batting Practice, Worms",60
1253,15,116,2021-04-18 18:01:46+00:00,Margarito Nava's baserunning was boosted.,117,"Blessing Won: Shadow Running Practice, Flowers",60
1254,15,116,2021-04-18 18:01:46+00:00,Owen Picklestein's baserunning was boosted.,117,"Blessing Won: Shadow Running Practice, Flowers",60
1255,15,116,2021-04-18 18:01:46+00:00,Susananana Portmanteau's hitting was boosted.,117,"Blessing Won: Shadow Batting Practice, Worms",60
1256,15,116,2021-04-18 18:01:46+00:00,Persephone Splotter's hitting was boosted.,117,"Blessing Won: Shadow Batting Practice, Worms",60
1257,15,116,2021-04-18 18:01:46+00:00,Eizabeth Elliott entered the Shadows.,117,"Blessing Won: Weakest Link, Magic",60
1258,15,116,2021-04-18 18:01:46+00:00,Atma Willowtree's hitting was boosted.,117,"Blessing Won: Shadow Batting Practice, Worms",60
1259,15,116,2021-04-18 18:01:46+00:00,Matteo Cash's hitting was boosted.,117,"Blessing Won: Shadow Batting Practice, Worms",60
1260,15,116,2021-04-18 18:01:46+00:00,Ephraim Ladd's hitting was boosted.,117,"Blessing Won: Shadow Batting Practice, Worms",60
1261,15,116,2021-04-18 18:01:46+00:00,Clove Mahle's hitting was boosted.,117,"Blessing Won: Shadow Batting Practice, Worms",60
1262,15,116,2021-04-18 18:01:46+00:00,Rocio Caster's hitting was boosted.,117,"Blessing Won: Shadow Batting Practice, Worms",60
1263,15,116,2021-04-18 18:01:46+00:00,Bartleby Zhivago's hitting was boosted.,117,"Blessing Won: Shadow Batting Practice, Worms",60
1264,15,116,2021-04-18 18:01:46+00:00,Norman Muggins' hitting was boosted.,117,"Blessing Won: Shadow Batting Practice, Worms",60
1265,15,116,2021-04-18 18:01:46+00:00,Avi Jones' hitting was boosted.,117,"Blessing Won: Shadow Batting Practice, Worms",60
1266,15,116,2021-04-18 18:01:46+00:00,Nyx Snapjaw's hitting was boosted.,117,"Blessing Won: Shadow Batting Practice, Worms",60
1267,15,116,2021-04-18 18:01:46+00:00,Cantus Hojo's hitting was boosted.,117,"Blessing Won: Shadow Batting Practice, Worms",60
1268,15,116,2021-04-18 18:01:46+00:00,Francisco Object's baserunning was boosted.,117,"Blessing Won: Shadow Running Practice, Flowers",60
1269,15,116,2021-04-18 18:01:47+00:00,Leticia Snyder's pitching was boosted.,117,"Blessing Won: Shadow Pitching Practice, Garages",60
1270,15,116,2021-04-18 18:01:47+00:00,Emblem Warhorse's pitching was boosted.,117,"Blessing Won: Shadow Pitching Practice, Garages",60
1271,15,116,2021-04-18 18:01:47+00:00,Wade Howe's baserunning was boosted.,117,"Blessing Won: Shadow Running Practice, Flowers",60
1272,15,116,2021-04-18 18:01:47+00:00,Antonio Mccall's pitching was boosted.,117,"Blessing Won: Shadow Pitching Practice, Garages",60
1273,15,116,2021-04-18 18:01:47+00:00,Emilia Street's defense was boosted.,117,"Blessing Won: Shadow Defense Practice, Garages",60
1274,15,116,2021-04-18 18:01:47+00:00,Tillman Wan's pitching was boosted.,117,"Blessing Won: Shadow Pitching Practice, Garages",60
1275,15,116,2021-04-18 18:01:47+00:00,Shaquille Sunshine's baserunning was boosted.,117,"Blessing Won: Shadow Running Practice, Flowers",60
1276,15,116,2021-04-18 18:01:47+00:00,Lori Boston's pitching was boosted.,117,"Blessing Won: Shadow Pitching Practice, Garages",60
1277,15,116,2021-04-18 18:01:47+00:00,Tristin Crankit's baserunning was boosted.,117,"Blessing Won: Shadow Running Practice, Flowers",60
1278,15,116,2021-04-18 18:01:47+00:00,Daniel Benedicte's defense was boosted.,117,"Blessing Won: Shadow Defense Practice, Garages",60
1279,15,116,2021-04-18 18:01:47+00:00,Zeboriah Wilson's baserunning was boosted.,117,"Blessing Won: Shadow Running Practice, Flowers",60
1280,15,116,2021-04-18 18:01:47+00:00,Ortiz Morse's pitching was boosted.,117,"Blessing Won: Shadow Pitching Practice, Garages",60
1281,15,116,2021-04-18 18:01:47+00:00,Stephanie Schmitt's baserunning was boosted.,117,"Blessing Won: Shadow Running Practice, Flowers",60
1282,15,116,2021-04-18 18:01:47+00:00,Jenkins Ingram's baserunning was boosted.,117,"Blessing Won: Shadow Running Practice, Flowers",60
1283,15,116,2021-04-18 18:01:47+00:00,Daniel Benedicte's pitching was boosted.,117,"Blessing Won: Shadow Pitching Practice, Garages",60
1284,15,116,2021-04-18 18:01:47+00:00,Freemium Fairwood's defense was boosted.,117,"Blessing Won: Shadow Defense Practice, Garages",60
1285,15,116,2021-04-18 18:01:47+00:00,Tad Blortles' baserunning was boosted.,117,"Blessing Won: Shadow Running Practice, Flowers",60
1286,15,116,2021-04-18 18:01:47+00:00,Schneider Blanco's defense was boosted.,117,"Blessing Won: Shadow Defense Practice, Garages",60
1287,15,116,2021-04-18 18:01:47+00:00,Arturo Huerta's pitching was boosted.,117,"Blessing Won: Shadow Pitching Practice, Garages",60
1288,15,116,2021-04-18 18:01:47+00:00,Leticia Snyder's defense was boosted.,117,"Blessing Won: Shadow Defense Practice, Garages",60
1289,15,116,2021-04-18 18:01:47+00:00,Summers Pony's defense was boosted.,117,"Blessing Won: Shadow Defense Practice, Garages",60
1290,15,116,2021-04-18 18:01:47+00:00,Schneider Blanco's pitching was boosted.,117,"Blessing Won: Shadow Pitching Practice, Garages",60
1291,15,116,2021-04-18 18:01:47+00:00,Freemium Fairwood's pitching was boosted.,117,"Blessing Won: Shadow Pitching Practice, Garages",60
1292,15,116,2021-04-18 18:01:47+00:00,Stu Mcdaniel's baserunning was boosted.,117,"Blessing Won: Shadow Running Practice, Flowers",60
1293,15,116,2021-04-18 18:01:47+00:00,Conditional Yuniesky's defense was boosted.,117,"Blessing Won: Shadow Defense Practice, Garages",60
1294,15,116,2021-04-18 18:01:47+00:00,Terrell Bradley's pitching was boosted.,117,"Blessing Won: Shadow Pitching Practice, Garages",60
1295,15,116,2021-04-18 18:01:47+00:00,Emblem Warhorse's defense was boosted.,117,"Blessing Won: Shadow Defense Practice, Garages",60
1296,15,116,2021-04-18 18:01:47+00:00,Emilia Street's pitching was boosted.,117,"Blessing Won: Shadow Pitching Practice, Garages",60
1297,15,116,2021-04-18 18:01:47+00:00,Mcdowell Karim's pitching was boosted.,117,"Blessing Won: Shadow Pitching Practice, Garages",60
1298,15,116,2021-04-18 18:01:47+00:00,Elijah Bookbaby's baserunning was boosted.,117,"Blessing Won: Shadow Running Practice, Flowers",60
1299,15,116,2021-04-18 18:01:47+00:00,Summers Pony's pitching was boosted.,117,"Blessing Won: Shadow Pitching Practice, Garages",60
1300,15,116,2021-04-18 18:01:47+00:00,Terrell Bradley's defense was boosted.,117,"Blessing Won: Shadow Defense Practice, Garages",60
1301,15,116,2021-04-18 18:01:47+00:00,Arturo Huerta's defense was boosted.,117,"Blessing Won: Shadow Defense Practice, Garages",60
1302,15,116,2021-04-18 18:01:47+00:00,Mcdowell Karim's defense was boosted.,117,"Blessing Won: Shadow Defense Practice, Garages",60
1303,15,116,2021-04-18 18:01:47+00:00,Lori Boston's defense was boosted.,117,"Blessing Won: Shadow Defense Practice, Garages",60
1304,15,116,2021-04-18 18:01:47+00:00,Kiki Junior Jr's baserunning was boosted.,117,"Blessing Won: Shadow Running Practice, Flowers",60
1305,15,116,2021-04-18 18:01:47+00:00,Ortiz Morse's defense was boosted.,117,"Blessing Won: Shadow Defense Practice, Garages",60
1306,15,116,2021-04-18 18:01:47+00:00,Antonio Mccall's defense was boosted.,117,"Blessing Won: Shadow Defense Practice, Garages",60
1307,15,116,2021-04-18 18:01:47+00:00,Chambers Kennedy's baserunning was boosted.,117,"Blessing Won: Shadow Running Practice, Flowers",60
1308,15,116,2021-04-18 18:01:47+00:00,Jasper Destiny's baserunning was boosted.,117,"Blessing Won: Shadow Running Practice, Flowers",60
1309,15,116,2021-04-18 18:01:47+00:00,Tillman Wan's defense was boosted.,117,"Blessing Won: Shadow Defense Practice, Garages",60
1310,15,116,2021-04-18 18:01:47+00:00,Conditional Yuniesky's pitching was boosted.,117,"Blessing Won: Shadow Pitching Practice, Garages",60
1311,15,116,2021-04-18 18:01:47+00:00,Zeboriah Whiskey's baserunning was boosted.,117,"Blessing Won: Shadow Running Practice, Flowers",60
1312,16,0,2021-04-19 15:20:59+00:00,Trinity Smaht replaced the incinerated Chorby Soul.,116,"Chorby Soul is Unstable!
A Debt was collected.
Rogue Umpire incinerated Chorby Soul!
They're replaced by Trinity Smaht.
The Instability chains to Luis Acevedo!",54
1313,16,1,2021-04-19 16:18:29+00:00,Jon Halifax replaced the incinerated Luis Acevedo.,116,"Luis Acevedo is Unstable!
A Debt was collected.
Rogue Umpire incinerated Luis Acevedo!
They're replaced by Jon Halifax.
The Instability chains to Parker Parra!",54
1314,16,11,2021-04-20 02:18:19+00:00,Donna Milicic replaced the incinerated Pudge Nakamoto.,116,"Rogue Umpire incinerated Pudge Nakamoto!
They're replaced by Donna Milicic.",54
1315,16,35,2021-04-21 03:18:24+00:00,Allan Kranch replaced the incinerated Hiroto Cerna.,116,"Rogue Umpire incinerated Hiroto Cerna!
They're replaced by Allan Kranch.",54
1316,16,43,2021-04-21 11:03:36+00:00,Rylan O'Lantern replaced the incinerated Stijn Strongbody.,116,"Rogue Umpire incinerated Stijn Strongbody!
They're replaced by Rylan O'Lantern.",54
1317,16,53,2021-04-21 21:23:09+00:00,Jon Tumblehome replaced the incinerated Hercules Alighieri.,116,"Rogue Umpire incinerated Hercules Alighieri!
They're replaced by Jon Tumblehome.",54
1318,16,61,2021-04-22 05:04:51+00:00,Frankie Incarnate replaced the incinerated Allison Abbott.,116,"Rogue Umpire incinerated Allison Abbott!
They're replaced by Frankie Incarnate.",54
1319,16,73,2021-04-22 18:17:55+00:00,Yummy Elliott entered the Shadows.,117,"10 Runs collected.
Incoming Shadow Fax...
Yummy Elliott is replaced by McBaseball Clembons.",191
1320,16,73,2021-04-22 18:26:30+00:00,Bottles Suljak entered the Shadows.,117,"10 Runs collected.
Incoming Shadow Fax...
Bottles Suljak is replaced by Cravel Gesundheit.",191
1321,16,76,2021-04-22 21:13:48+00:00,Parker Parra entered the Shadows.,117,"10 Runs collected.
Incoming Shadow Fax...
Parker Parra is replaced by Lorcan Smaht.",191
1322,16,76,2021-04-22 21:17:03+00:00,McBaseball Clembons entered the Shadows.,117,"10 Runs collected.
Incoming Shadow Fax...
McBaseball Clembons is replaced by Yummy Elliott.",191
1323,16,77,2021-04-22 22:20:55+00:00,Bright Zimmerman entered the Shadows.,117,"10 Runs collected.
Incoming Shadow Fax...
Bright Zimmerman is replaced by Oscar Dollie.",191
1324,16,77,2021-04-22 22:26:07+00:00,Kelvin Drumsolo is Partying!,117,Kelvin Drumsolo is Partying!,24
1325,16,79,2021-04-23 00:18:52+00:00,PolkaDot Patterson is Partying!,117,PolkaDot Patterson is Partying!,24
1326,16,79,2021-04-23 00:21:07+00:00,Christian Combs is Partying!,117,Christian Combs is Partying!,24
1327,16,80,2021-04-23 01:09:07+00:00,Gia Holbrook is Partying!,117,Gia Holbrook is Partying!,24
1328,16,80,2021-04-23 01:14:08+00:00,Cravel Gesundheit is Partying!,117,Cravel Gesundheit is Partying!,24
1329,16,82,2021-04-23 03:04:45+00:00,Bees Taswell is Partying!,117,Bees Taswell is Partying!,24
1330,16,82,2021-04-23 03:13:42+00:00,Christian Combs is Partying!,117,Christian Combs is Partying!,24
1331,16,82,2021-04-23 03:19:22+00:00,Lorcan Smaht is Partying!,117,Lorcan Smaht is Partying!,24
1332,16,83,2021-04-23 04:06:07+00:00,Sandoval Crossing is Partying!,117,Sandoval Crossing is Partying!,24
1333,16,83,2021-04-23 04:11:36+00:00,Jon Halifax is Partying!,117,Jon Halifax is Partying!,24
1334,16,83,2021-04-23 04:13:26+00:00,Tot Fox is Partying!,117,Tot Fox is Partying!,24
1335,16,83,2021-04-23 04:27:32+00:00,Lorcan Smaht is Partying!,117,Lorcan Smaht is Partying!,24
1336,16,84,2021-04-23 05:21:12+00:00,Helga Moreno is Partying!,117,Helga Moreno is Partying!,24
1337,16,84,2021-04-23 05:23:57+00:00,Randy Castillo is Partying!,117,Randy Castillo is Partying!,24
1338,16,85,2021-04-23 06:12:57+00:00,Greer Gwiffin is Partying!,117,Greer Gwiffin is Partying!,24
1339,16,86,2021-04-23 07:07:38+00:00,Jolene Willowtree is Partying!,117,Jolene Willowtree is Partying!,24
1340,16,86,2021-04-23 07:12:54+00:00,Matteo Triumphant is Partying!,117,Matteo Triumphant is Partying!,24
1341,16,86,2021-04-23 07:18:29+00:00,Don Mitchell is Partying!,117,Don Mitchell is Partying!,24
1342,16,86,2021-04-23 07:22:09+00:00,Sandie Carver entered the Shadows.,117,"10 Runs collected.
Incoming Shadow Fax...
Sandie Carver is replaced by Albert Stink.",191
1343,16,86,2021-04-23 07:28:00+00:00,Chorby Short is Partying!,117,Chorby Short is Partying!,24
1344,16,87,2021-04-23 08:02:51+00:00,Ayanna Dumpington is Partying!,117,Ayanna Dumpington is Partying!,24
1345,16,87,2021-04-23 08:05:01+00:00,Jayden Wright is Partying!,117,Jayden Wright is Partying!,24
1346,16,87,2021-04-23 08:09:22+00:00,Mindy Kugel is Partying!,117,Mindy Kugel is Partying!,24
1347,16,87,2021-04-23 08:11:08+00:00,Lorcan Smaht is Partying!,117,Lorcan Smaht is Partying!,24
