,season,day,timestamp,description,event_type,parent_description,parent_event_type
2907,21,112,2021-07-03 20:34:56+00:00,Erickson Fischer entered the Shadows.,117,"Worldwide Field Thieves' Guild convened.
They stole Millennials' Shadows player Erickson Fischer!",231
2908,21,113,2021-07-03 21:17:29+00:00,Uncle Plasma XIV entered the Shadows.,117,"10 Runs collected.
Incoming Shadow Fax...
Uncle Plasma XIV is replaced by Cudi Di Batterino.",191
2909,21,115,2021-07-04 18:01:05+00:00,Kurt Crueller entered the Shadows.,117,Will Received: Roster Swap,61
2910,21,115,2021-07-04 18:01:05+00:00,Twofurious Puddles entered the Shadows.,117,Will Received: Move,61
2911,21,115,2021-07-04 18:01:06+00:00,Paula Turnip entered the Shadows.,117,Will Received: Move,61
2912,21,115,2021-07-04 18:01:06+00:00,Mags Banananana was boosted.,117,Will Received: Shadow Revoke,61
2913,21,115,2021-07-04 18:01:06+00:00,Lenny Marijuana's Defense is Infused.,117,Will Received: Shadow Infuse,61
2914,21,115,2021-07-04 18:01:06+00:00,Alyssa Harrell entered the Shadows.,117,Will Received: Move,61
2915,21,115,2021-07-04 18:01:06+00:00,Chorby Short entered the Shadows.,117,Will Received: Move,61
2916,21,115,2021-07-04 18:01:06+00:00,Jolene Willowtree entered the Shadows.,117,Will Received: Roster Swap,61
2917,21,115,2021-07-04 18:01:06+00:00,Vito Kravitz entered the Shadows.,117,Will Received: Move,61
2918,21,115,2021-07-04 18:01:06+00:00,Crow Madrigal's Defense is Infused.,117,Will Received: Shadow Infuse,61
2919,21,115,2021-07-04 18:01:06+00:00,Chorby Short entered the Shadows.,117,Will Received: Roster Swap,61
2920,21,115,2021-07-04 18:01:06+00:00,Fitzgerald Wanderlust entered the Shadows.,117,Will Received: Roster Swap,61
2921,21,115,2021-07-04 18:01:06+00:00,Ren Morin's Defense is Infused.,117,Will Received: Shadow Infuse,61
2922,21,115,2021-07-04 18:01:06+00:00,Castillo Turner entered the Shadows.,117,Will Received: Equivalent Exchange,61
2923,21,115,2021-07-04 18:01:06+00:00,Gallup Crueller's Pitching is Infused.,117,Will Received: Shadow Infuse,61
2924,21,115,2021-07-04 18:01:06+00:00,Bees ----el-'s Batting is Infused.,117,Will Received: Shadow Infuse,61
2925,21,115,2021-07-04 18:01:06+00:00,Donia Bailey's Baserunning is Infused.,117,Will Received: Shadow Infuse,61
2926,21,115,2021-07-04 18:01:09+00:00,Lang Richardson entered the Shadows.,117,"Blessing Won: Gachapon, Garages",60
2927,21,115,2021-07-04 18:01:09+00:00,Torus McGhee entered the Shadows.,117,"Blessing Won: Gachapon, Garages",60
2928,21,115,2021-07-04 18:01:09+00:00,Parker Parra entered the Shadows.,117,"Blessing Won: Gachapon, Garages",60
2929,21,115,2021-07-04 18:01:09+00:00,Jordan Hildebert's Alternate is called.,145,"Blessing Won: Lineup Alternate Trust, Shoe Thieves",60
2930,21,115,2021-07-04 18:01:09+00:00,Avila Baker entered the Shadows.,117,"Blessing Won: Gachapon, Garages",60
2931,21,115,2021-07-04 18:01:09+00:00,Enid Marlow's Alternate is called.,145,"Blessing Won: Handful Alternate Trust, Crabs",60
2932,21,115,2021-07-04 18:01:09+00:00,Castillo Turner entered the Shadows.,117,"Blessing Won: Gachapon, Garages",60
2933,21,115,2021-07-04 18:01:09+00:00,Reese Harrington entered the Shadows.,117,"Blessing Won: Gachapon, Garages",60
2934,21,115,2021-07-04 18:01:09+00:00,Uncle Plasma II entered the Shadows.,117,"Blessing Won: Gachapon, Garages",60
2935,21,115,2021-07-04 18:01:09+00:00,Flattery Strewnberry entered the Shadows.,117,"Blessing Won: Gachapon, Garages",60
2936,21,115,2021-07-04 18:01:09+00:00,Yams Rolsenthal entered the Shadows.,117,"Blessing Won: Gachapon, Garages",60
2937,21,115,2021-07-04 18:01:09+00:00,Aureliano Cerna entered the Shadows.,117,"Blessing Won: Gachapon, Garages",60
2938,21,115,2021-07-04 18:01:09+00:00,Tad Seeth was boosted.,117,"Blessing Won: Big Swap, Shoe Thieves",60
2939,21,115,2021-07-04 18:01:09+00:00,Tucker Flores entered the Shadows.,117,"Blessing Won: Gachapon, Garages",60
2940,21,115,2021-07-04 18:01:09+00:00,Dickerson Morse entered the Shadows.,117,"Blessing Won: Gachapon, Garages",60
2941,21,115,2021-07-04 18:01:09+00:00,Serge Shortvat entered the Shadows.,117,"Blessing Won: Gachapon, Garages",60
2942,21,115,2021-07-04 18:01:09+00:00,Djuna Scoresburg entered the Shadows.,117,"Blessing Won: Gachapon, Garages",60
2943,21,115,2021-07-04 18:01:09+00:00,Fynn Doyle entered the Shadows.,117,"Blessing Won: Gachapon, Garages",60
2944,21,115,2021-07-04 18:01:09+00:00,Fairwood Patchwork's Alternate is called.,145,"Blessing Won: Handful Alternate Trust, Crabs",60
2945,21,115,2021-07-04 18:01:09+00:00,Lorcan Smaht's Alternate is called.,145,"Blessing Won: Handful Alternate Trust, Crabs",60
2946,21,115,2021-07-04 18:01:09+00:00,Alston Cerveza's Alternate is called.,145,"Blessing Won: Handful Alternate Trust, Crabs",60
2947,21,115,2021-07-04 18:01:09+00:00,Ezekiel Throckmorton entered the Shadows.,117,"Blessing Won: Gachapon, Garages",60
2948,21,115,2021-07-04 18:01:09+00:00,Axel Cardenas entered the Shadows.,117,"Blessing Won: Gachapon, Garages",60
2949,21,115,2021-07-04 18:01:09+00:00,Velasquez Alstott's Alternate is called.,145,"Blessing Won: Lineup Alternate Trust, Shoe Thieves",60
2950,21,115,2021-07-04 18:01:09+00:00,Doc Cash entered the Shadows.,117,"Blessing Won: Gachapon, Garages",60
2951,21,115,2021-07-04 18:01:09+00:00,Winnie Loser entered the Shadows.,117,"Blessing Won: Gachapon, Garages",60
2952,21,115,2021-07-04 18:01:09+00:00,Backpatch Lincecum entered the Shadows.,117,"Blessing Won: Gachapon, Garages",60
2953,21,115,2021-07-04 18:01:09+00:00,Tad Seeth's Alternate is called.,145,"Blessing Won: Lineup Alternate Trust, Shoe Thieves",60
2954,21,115,2021-07-04 18:01:09+00:00,Kennedy Loser's Alternate is called.,145,"Blessing Won: Handful Alternate Trust, Crabs",60
2955,21,115,2021-07-04 18:01:09+00:00,Mayra Buckley entered the Shadows.,117,"Blessing Won: Gachapon, Garages",60
2956,21,115,2021-07-04 18:01:09+00:00,Conrad Twelve entered the Shadows.,117,"Blessing Won: Gachapon, Garages",60
2957,21,115,2021-07-04 18:01:09+00:00,Moody Rodriguez entered the Shadows.,117,"Blessing Won: Gachapon, Garages",60
2958,21,115,2021-07-04 18:01:10+00:00,Pug Meatbrick's Alternate is called.,145,"Blessing Won: Shadow Alternate Trust, Fridays",60
2959,21,115,2021-07-04 18:01:10+00:00,Yosh Carpenter's Alternate is called.,145,"Blessing Won: Shadow Alternate Trust, Fridays",60
2960,21,115,2021-07-04 18:01:10+00:00,Fenry Marlow's Alternate is called.,145,"Blessing Won: Rotation Alternate Trust, Fridays",60
2961,21,115,2021-07-04 18:01:10+00:00,Mckinney Vaughan's Alternate is called.,145,"Blessing Won: Shadow Alternate Trust, Fridays",60
2962,21,115,2021-07-04 18:01:10+00:00,Itsuki Winner's Alternate is called.,145,"Blessing Won: Shadow Alternate Trust, Fridays",60
2963,21,115,2021-07-04 18:01:10+00:00,Nicholas Mora's Alternate is called.,145,"Blessing Won: Shadow Alternate Trust, Fridays",60
2964,21,115,2021-07-04 18:01:10+00:00,Johnnyboy Aster's Alternate is called.,145,"Blessing Won: Shadow Alternate Trust, Fridays",60
2965,21,115,2021-07-04 18:01:10+00:00,Alyssa Harrell's Alternate is called.,145,"Blessing Won: Shadow Alternate Trust, Fridays",60
2966,21,115,2021-07-04 18:01:10+00:00,Sutton Dreamy's Alternate is called.,145,"Blessing Won: Shadow Alternate Trust, Fridays",60
2967,21,115,2021-07-04 18:01:10+00:00,Spears Taylor's Alternate is called.,145,"Blessing Won: Shadow Alternate Trust, Fridays",60
2968,21,115,2021-07-04 18:01:10+00:00,Cory Novak's Alternate is called.,145,"Blessing Won: Shadow Alternate Trust, Fridays",60
2969,21,115,2021-07-04 18:01:10+00:00,Timmy Manco's Alternate is called.,145,"Blessing Won: Shadow Alternate Trust, Fridays",60
2970,21,115,2021-07-04 18:01:10+00:00,Whimsy Ng's Alternate is called.,145,"Blessing Won: Shadow Alternate Trust, Fridays",60
2971,21,115,2021-07-04 18:01:10+00:00,Garcia Tabby's Alternate is called.,145,"Blessing Won: Shadow Alternate Trust, Fridays",60
2972,21,115,2021-07-04 18:01:10+00:00,Lizzy Pasta's Alternate is called.,145,"Blessing Won: Shadow Alternate Trust, Fridays",60
2973,21,115,2021-07-04 18:01:10+00:00,Leticia Lozano's Alternate is called.,145,"Blessing Won: Shadow Alternate Trust, Fridays",60
2974,21,115,2021-07-04 18:01:10+00:00,Don Mitchell's Alternate is called.,145,"Blessing Won: Alternate Bust, Fridays",60
2975,21,115,2021-07-04 18:01:10+00:00,Juice Collins' Alternate is called.,145,"Blessing Won: Rotation Alternate Trust, Fridays",60
2976,21,115,2021-07-04 18:01:10+00:00,Jammy Decksetter's Alternate is called.,145,"Blessing Won: Shadow Alternate Trust, Fridays",60
2977,21,115,2021-07-04 18:01:10+00:00,Caleb Morin's Alternate is called.,145,"Blessing Won: Shadow Alternate Trust, Fridays",60
2978,21,115,2021-07-04 18:01:10+00:00,Butch Wyeth's Alternate is called.,145,"Blessing Won: Shadow Alternate Trust, Fridays",60
2979,21,115,2021-07-04 18:01:10+00:00,Stephanie Donaldson's Alternate is called.,145,"Blessing Won: Shadow Alternate Trust, Fridays",60
2980,21,115,2021-07-04 18:01:10+00:00,Hops Slumps' Alternate is called.,145,"Blessing Won: Shadow Alternate Trust, Fridays",60
2981,21,115,2021-07-04 18:01:10+00:00,Yasslyn Statter Jr.'s Alternate is called.,145,"Blessing Won: Shadow Alternate Trust, Fridays",60
2982,21,115,2021-07-04 18:01:10+00:00,Mordecai Kingbird's Alternate is called.,145,"Blessing Won: Shadow Alternate Trust, Fridays",60
2983,21,115,2021-07-04 18:01:11+00:00,Alx Keming entered the Shadows.,117,"Blessing Won: Mass Attraction, Magic",60
2984,22,0,2021-07-19 15:25:10+00:00,Engine Eberhardt is Partying!,117,"Engine Eberhardt steals fourth base!
Engine Eberhardt is Partying!
A flock of Birds are attracted to LA Taquería!",4
2985,22,0,2021-07-19 15:29:22+00:00,Jon Halifax entered the Shadows.,117,"10 Runs collected.
Incoming Shadow Fax...
Jon Halifax is replaced by Kina Larsen.",191
2986,22,0,2021-07-19 15:31:23+00:00,Leo Baron entered the Shadows.,117,"The Meadow Thieves' Guild convened.
They stole Magic's Shadows player Leo Baron!",231
2987,22,1,2021-07-19 16:27:39+00:00,Riley Firewall entered the Shadows.,117,"10 Runs collected.
Incoming Shadow Fax...
Riley Firewall is replaced by Zippy DeShields.",191
2988,22,1,2021-07-19 16:31:39+00:00,Mummy Cantburn entered the Shadows.,117,"The Gleek Thieves' Guild convened.
They stole Pies' Shadows player Mummy Cantburn!",231
2989,22,2,2021-07-19 17:12:17+00:00,Dunn Keyes entered the Shadows.,117,"10 Runs collected.
Incoming Shadow Fax...
Dunn Keyes is replaced by Chorby Short.",191
2990,22,2,2021-07-19 17:19:13+00:00,McBaseball Clembons entered the Shadows.,117,"10 Runs collected.
Incoming Shadow Fax...
McBaseball Clembons is replaced by L---s Pe--y.",191
2991,22,3,2021-07-19 18:12:16+00:00,Chet Takahashi entered the Shadows.,117,"10 Runs collected.
Incoming Shadow Fax...
Chet Takahashi is replaced by Plums Blather.",191
2992,22,3,2021-07-19 18:24:41+00:00,Quack Hookrace entered the Shadows.,117,"The Fire House Thieves' Guild convened.
They stole Lift's Shadows player Quack Hookrace!",231
2993,22,3,2021-07-19 18:38:17+00:00,Atma Blueberry entered the Shadows.,117,"REDACTED Thieves' Guild convened.
They stole Dale's Shadows player Atma Blueberry!",231
2994,22,6,2021-07-19 21:21:44+00:00,Clove Mahle is Partying!,117,"Jaxon Buckley hits a Single!
Clove Mahle scores!
Clove Mahle is Partying!
A flock of Birds are attracted to Battin' Island!",10
2995,22,6,2021-07-19 21:22:09+00:00,Lotus Mango is Partying!,117,"Jaxon Buckley out at second base.
Lotus Mango scores!
Clove Mahle reaches on fielder's choice.
Lotus Mango is Partying!
A flock of Birds are attracted to Battin' Island!",8
2996,22,7,2021-07-19 22:04:31+00:00,Eugenia Garbage is Partying!,117,"Slosh Truk hit a ground out to Samothes Dembélé.
Eugenia Garbage advances on the sacrifice.
Eugenia Garbage is Partying!
A flock of Birds are attracted to The Cookout!",8
2997,22,7,2021-07-19 22:13:42+00:00,Plums Blather entered the Shadows.,117,"10 Runs collected.
Incoming Shadow Fax...
Plums Blather is replaced by Chet Takahashi.",191
2998,22,9,2021-07-20 00:01:01+00:00,Swamuel Mora is Partying!,117,"Swamuel Mora hits a solo home run!
Swamuel Mora is Partying!
A flock of Birds are attracted to The Solarium!",9
2999,22,9,2021-07-20 00:01:16+00:00,Gabriel Griffith is Partying!,117,"Gabriel Griffith hits a solo home run!
One of The Solarium's Balloons was struck and popped!
7 Birds were scared away!
Gabriel Griffith is Partying!
A flock of Birds are attracted to The Solarium!",9
3000,22,9,2021-07-20 00:22:03+00:00,Zippy DeShields entered the Shadows.,117,"10 Runs collected.
Incoming Shadow Fax...
Zippy DeShields is replaced by Riley Firewall.",191
3001,22,9,2021-07-20 00:25:02+00:00,Fairwood Patchwork entered the Shadows.,117,"Home Team Shutout.
Incoming Voicemail...
Fairwood Patchwork is replaced by Pedro Davids.",228
3002,22,10,2021-07-20 01:15:22+00:00,Ortiz Lopez entered the Shadows.,117,"10 Runs collected.
Incoming Shadow Fax...
Ortiz Lopez is replaced by Steals Chark.",191
3003,22,10,2021-07-20 01:25:57+00:00,Jayden Wright entered the Shadows.,117,"10 Runs collected.
Incoming Shadow Fax...
Jayden Wright is replaced by Sandoval Crossing.",191
3004,22,11,2021-07-20 02:30:55+00:00,Bartleby Zhivago entered the Shadows.,117,"The Ampitheater Thieves' Guild convened.
They stole Worms' Shadows player Bartleby Zhivago!",231
3005,22,13,2021-07-20 04:22:44+00:00,Mindy Kugel entered the Shadows.,117,"10 Runs collected.
Incoming Shadow Fax...
Mindy Kugel is replaced by Jolene Willowtree.",191
3006,22,13,2021-07-20 04:31:50+00:00,----- -----h entered the Shadows.,117,"Home Team Shutout.
Incoming Voicemail...
----- -----h is replaced by Mindy Kugel.",228
3007,22,14,2021-07-20 05:06:13+00:00,Logan Rodriguez is Partying!,117,"Bonk Jokes hit a ground out to Stu Trololol.
Logan Rodriguez advances on the sacrifice.
Logan Rodriguez is Partying!
A flock of Birds are attracted to Yellowstone!",8
3008,22,14,2021-07-20 05:25:14+00:00,Ilane Snart entered the Shadows.,117,"10 Runs collected.
Incoming Shadow Fax...
Ilane Snart is replaced by -ug-st- R--dick.",191
3009,22,16,2021-07-20 07:11:18+00:00,Joshua Watson is Partying!,117,"Burke Gonzales hits a Double!
Joshua Watson scores!
Joshua Watson is Partying!
A flock of Birds are attracted to The Garden!",10
3010,22,16,2021-07-20 07:11:48+00:00,Burke Gonzales is Partying!,117,"Matteo Cash hit a ground out to Glabe Moon.
Burke Gonzales advances on the sacrifice.
Burke Gonzales is Partying!
A flock of Birds are attracted to The Garden!",8
3011,22,16,2021-07-20 07:12:53+00:00,Summers Preston is Partying!,117,"Summers Preston hits a 3-run home run!
Huber Frumple is Partying!
A flock of Birds are attracted to The Garden!
Stephanie Winters is Partying!
A flock of Birds are attracted to The Garden!
Summers Preston is Partying!
A flock of Birds are attracted to The Garden!",9
3012,22,16,2021-07-20 07:12:53+00:00,Huber Frumple is Partying!,117,"Summers Preston hits a 3-run home run!
Huber Frumple is Partying!
A flock of Birds are attracted to The Garden!
Stephanie Winters is Partying!
A flock of Birds are attracted to The Garden!
Summers Preston is Partying!
A flock of Birds are attracted to The Garden!",9
3013,22,16,2021-07-20 07:12:53+00:00,Stephanie Winters is Partying!,117,"Summers Preston hits a 3-run home run!
Huber Frumple is Partying!
A flock of Birds are attracted to The Garden!
Stephanie Winters is Partying!
A flock of Birds are attracted to The Garden!
Summers Preston is Partying!
A flock of Birds are attracted to The Garden!",9
3014,22,16,2021-07-20 07:15:23+00:00,Chambers Kennedy is Partying!,117,"Zeboriah Whiskey hits a 3-run home run!
Chambers Kennedy is Partying!
A flock of Birds are attracted to The Garden!
Inez Owens is Partying!
A flock of Birds are attracted to The Garden!
Zeboriah Whiskey is Partying!
A flock of Birds are attracted to The Garden!",9
3015,22,16,2021-07-20 07:15:23+00:00,Inez Owens is Partying!,117,"Zeboriah Whiskey hits a 3-run home run!
Chambers Kennedy is Partying!
A flock of Birds are attracted to The Garden!
Inez Owens is Partying!
A flock of Birds are attracted to The Garden!
Zeboriah Whiskey is Partying!
A flock of Birds are attracted to The Garden!",9
3016,22,16,2021-07-20 07:15:23+00:00,Zeboriah Whiskey is Partying!,117,"Zeboriah Whiskey hits a 3-run home run!
Chambers Kennedy is Partying!
A flock of Birds are attracted to The Garden!
Inez Owens is Partying!
A flock of Birds are attracted to The Garden!
Zeboriah Whiskey is Partying!
A flock of Birds are attracted to The Garden!",9
3017,22,16,2021-07-20 07:15:48+00:00,Lenny Spruce is Partying!,117,"Margarito Nava hits a Double!
Lenny Spruce scores!
Lenny Spruce is Partying!
A flock of Birds are attracted to The Garden!
The Garden inflates 1 Balloons!",10
3018,22,19,2021-07-20 10:24:02+00:00,Hendricks Richardson entered the Shadows.,117,"Home Team Shutout.
Incoming Voicemail...
Hendricks Richardson is replaced by Vito Kravitz.",228
3019,22,21,2021-07-20 12:23:46+00:00,Adelaide Judochop is Partying!,117,"Shirai McElroy hits a Single!
Adelaide Judochop scores!
Adelaide Judochop is Partying!
A flock of Birds are attracted to The Wormhole!",10
3020,22,21,2021-07-20 12:24:06+00:00,Adelaide Judochop is Partying!,117,"Mindy Kugel hit a flyout to Loubert Ji-Eun.
Adelaide Judochop tags up and scores!
Adelaide Judochop is Partying!
A flock of Birds are attracted to The Wormhole!",7
3021,22,22,2021-07-20 13:24:38+00:00,Rafael Davids entered the Shadows.,117,"10 Runs collected.
Incoming Shadow Fax...
Rafael Davids is replaced by Cat McSriff.",191
3022,22,23,2021-07-20 14:27:16+00:00,Finn James entered the Shadows.,117,"10 Runs collected.
Incoming Shadow Fax...
Finn James is replaced by Axel Campbell.",191
3023,22,23,2021-07-20 14:28:11+00:00,Axel Campbell entered the Shadows.,117,"10 Runs collected.
Incoming Shadow Fax...
Axel Campbell is replaced by Finn James.",191
3024,22,23,2021-07-20 14:31:06+00:00,Grit Watson entered the Shadows.,117,"The Crabitat Thieves' Guild convened.
They stole Firefighters' Shadows player Grit Watson!",231
3025,22,24,2021-07-20 15:22:23+00:00,Ren Hunter entered the Shadows.,117,"Home Team Shutout.
Incoming Voicemail...
Ren Hunter is replaced by Haruta Byrd.",228
3026,22,24,2021-07-20 15:24:31+00:00,Kina Larsen entered the Shadows.,117,"10 Runs collected.
Incoming Shadow Fax...
Kina Larsen is replaced by Leo Baron.",191
3027,22,24,2021-07-20 15:29:48+00:00,Rodriguez Internet entered the Shadows.,117,"Home Team Shutout.
Incoming Voicemail...
Rodriguez Internet is replaced by Bright Zimmerman.",228
3028,22,24,2021-07-20 15:29:53+00:00,Nicholas Mora entered the Shadows.,117,"The Meadow Thieves' Guild convened.
They stole Fridays' Shadows player Nicholas Mora!",231
3029,22,25,2021-07-20 16:20:18+00:00,Ayanna Dumpington is Partying!,117,"Erin Jesaulenko hit a ground out to Swamuel Mora.
Ayanna Dumpington advances on the sacrifice.
Ayanna Dumpington is Partying!
A flock of Birds are attracted to The Fire House!",8
3030,22,25,2021-07-20 16:22:09+00:00,Sandoval Crossing entered the Shadows.,117,"10 Runs collected.
Incoming Shadow Fax...
Sandoval Crossing is replaced by Jayden Wright.",191
3031,22,25,2021-07-20 16:29:28+00:00,Blood Hamburger entered the Shadows.,117,"10 Runs collected.
Incoming Shadow Fax...
Blood Hamburger is replaced by Inky Rutledge.",191
3032,22,27,2021-07-20 19:27:32+00:00,Alston Cerveza entered the Shadows.,117,"Home Team Shutout.
Incoming Voicemail...
Alston Cerveza is replaced by Axel Campbell.",228
3033,22,29,2021-07-20 21:30:41+00:00,Tiana Wheeler entered the Shadows.,117,"10 Runs collected.
Incoming Shadow Fax...
Tiana Wheeler is replaced by Uncle Plasma XII.",191
3034,22,30,2021-07-20 22:25:03+00:00,Clare Mccall entered the Shadows.,117,"10 Runs collected.
Incoming Shadow Fax...
Clare Mccall is replaced by Geepa Beanpot.",191
3035,22,30,2021-07-20 22:29:01+00:00,--l--- Sp---- entered the Shadows.,117,"Home Team Shutout.
Incoming Voicemail...
--l--- Sp---- is replaced by Lancelot Kane.",228
3036,22,32,2021-07-21 00:25:32+00:00,Cory Ross entered the Shadows.,117,"Home Team Shutout.
Incoming Voicemail...
Cory Ross is replaced by Barry Burkhard.",228
3037,22,34,2021-07-21 02:07:44+00:00,Mags Banananana entered the Shadows.,117,"10 Runs collected.
Incoming Shadow Fax...
Mags Banananana is replaced by Spears Nolan.",191
3038,22,34,2021-07-21 02:15:30+00:00,Leo Baron entered the Shadows.,117,"10 Runs collected.
Incoming Shadow Fax...
Leo Baron is replaced by Jon Halifax.",191
3039,22,34,2021-07-21 02:24:36+00:00,Velasquez Alstott entered the Shadows.,117,"Home Team Shutout.
Incoming Voicemail...
Velasquez Alstott is replaced by Blood Hamburger.",228
3040,22,34,2021-07-21 02:28:43+00:00,Bobbin Moss entered the Shadows.,117,"The Meadow Thieves' Guild convened.
They stole Dale's Shadows player Bobbin Moss!",231
3041,22,35,2021-07-21 03:26:21+00:00,Chet Takahashi entered the Shadows.,117,"10 Runs collected.
Incoming Shadow Fax...
Chet Takahashi is replaced by Plums Blather.",191
3042,22,35,2021-07-21 03:28:48+00:00,Silvia Rugrat entered the Shadows.,117,"10 Runs collected.
Incoming Shadow Fax...
Silvia Rugrat is replaced by Rafael Davids.",191
3043,22,35,2021-07-21 03:30:34+00:00,Jayden Wright entered the Shadows.,117,"10 Runs collected.
Incoming Shadow Fax...
Jayden Wright is replaced by Sandoval Crossing.",191
3044,22,37,2021-07-21 05:31:48+00:00,Mooney Doctor II entered the Shadows.,117,"Home Team Shutout.
Incoming Voicemail...
Mooney Doctor II is replaced by Rodriguez Internet.",228
3045,22,38,2021-07-21 06:02:18+00:00,Lachlan Shelton entered the Shadows.,117,"10 Runs collected.
Incoming Shadow Fax...
Lachlan Shelton is replaced by Ortiz Lopez.",191
3046,22,38,2021-07-21 06:08:51+00:00,Terrell Bradley entered the Shadows.,117,"10 Runs collected.
Incoming Shadow Fax...
Terrell Bradley is replaced by Uncle Plasma XIV.",191
3047,22,38,2021-07-21 06:23:47+00:00,Elwin McGhee entered the Shadows.,117,"Home Team Shutout.
Incoming Voicemail...
Elwin McGhee is replaced by Cicero Gubbins.",228
3048,22,38,2021-07-21 06:27:15+00:00,Penelope Mathews entered the Shadows.,117,"10 Runs collected.
Incoming Shadow Fax...
Penelope Mathews is replaced by Castillo Turner.",191
3049,22,38,2021-07-21 06:30:10+00:00,Bambi Perez entered the Shadows.,117,"The Big Garage Thieves' Guild convened.
They stole Pies' Shadows player Bambi Perez!",231
3050,22,39,2021-07-21 07:26:01+00:00,Spits Strongbody entered the Shadows.,117,"LA Taquería Thieves' Guild convened.
They stole Lift's Shadows player Spits Strongbody!",231
3051,22,40,2021-07-21 08:17:58+00:00,Wade Howe entered the Shadows.,117,"10 Runs collected.
Incoming Shadow Fax...
Wade Howe is replaced by Dunn Keyes.",191
3052,22,40,2021-07-21 08:18:27+00:00,Jon Halifax entered the Shadows.,117,"10 Runs collected.
Incoming Shadow Fax...
Jon Halifax is replaced by Mooney Doctor II.",191
3053,22,40,2021-07-21 08:31:36+00:00,Dunn Keyes entered the Shadows.,117,"10 Runs collected.
Incoming Shadow Fax...
Dunn Keyes is replaced by Jenkins Ingram.",191
3054,22,40,2021-07-21 08:33:36+00:00,Artemesia Teixeira entered the Shadows.,117,"The Meadow Thieves' Guild convened.
They stole Georgias' Shadows player Artemesia Teixeira!",231
3055,22,41,2021-07-21 09:16:34+00:00,Zack Sanders entered the Shadows.,117,"10 Runs collected.
Incoming Shadow Fax...
Zack Sanders is replaced by Jayden Wright.",191
3056,22,42,2021-07-21 10:15:13+00:00,Elvis Figueroa entered the Shadows.,117,"10 Runs collected.
Incoming Shadow Fax...
Elvis Figueroa is replaced by Zack Sanders.",191
3057,22,42,2021-07-21 10:27:28+00:00,Izuki Clark entered the Shadows.,117,"The Pillars Thieves' Guild convened.
They stole Steaks' Shadows player Izuki Clark!",231
3058,22,43,2021-07-21 11:18:59+00:00,Fran Beans entered the Shadows.,117,"10 Runs collected.
Incoming Shadow Fax...
Fran Beans is replaced by Silvia Rugrat.",191
3059,22,43,2021-07-21 11:34:52+00:00,Stephens Lightner entered the Shadows.,117,"The Ampitheater Thieves' Guild convened.
They stole Jazz Hands' Shadows player Stephens Lightner!",231
3060,22,44,2021-07-21 12:26:17+00:00,Munro Tumblehome entered the Shadows.,117,"Home Team Shutout.
Incoming Voicemail...
Munro Tumblehome is replaced by Schneide- Bendi-.",228
3061,22,44,2021-07-21 12:26:31+00:00,Tad Seeth entered the Shadows.,117,"Home Team Shutout.
Incoming Voicemail...
Tad Seeth is replaced by Vernon Shotwell.",228
3062,22,45,2021-07-21 13:23:46+00:00,Reese Clark entered the Shadows.,117,"Home Team Shutout.
Incoming Voicemail...
Reese Clark is replaced by Siobhan Chark.",228
3063,22,46,2021-07-21 14:22:24+00:00,The LCD Soundsystem boosted Siobhan Chark!,117,"Reality flickers. Things look different ...
Siobhan Chark and Sosa Hayes switch teams in the feedback!
The LCD Soundsystem is playing at the Spies' house!
Sosa Hayes is now batting.",41
3064,22,46,2021-07-21 14:22:24+00:00,The LCD Soundsystem boosted Sosa Hayes!,117,"Reality flickers. Things look different ...
Siobhan Chark and Sosa Hayes switch teams in the feedback!
The LCD Soundsystem is playing at the Spies' house!
Sosa Hayes is now batting.",41
3065,22,46,2021-07-21 14:28:24+00:00,Lowe Forbes entered the Shadows.,117,"10 Runs collected.
Incoming Shadow Fax...
Lowe Forbes is replaced by --l--- Sp----.",191
3066,22,47,2021-07-21 15:26:29+00:00,Phineas Wormthrice entered the Shadows.,117,"Home Team Shutout.
Incoming Voicemail...
Phineas Wormthrice is replaced by Guy Gulp.",228
3067,22,47,2021-07-21 15:27:29+00:00,Logan Rodriguez entered the Shadows.,117,"Home Team Shutout.
Incoming Voicemail...
Logan Rodriguez is replaced by Alx Keming.",228
3068,22,48,2021-07-21 16:23:09+00:00,Quack Enjoyable re-congealed differently.,117,Quack Enjoyable returned from Elsewhere after 5 days!,84
3069,22,48,2021-07-21 16:31:29+00:00,Jenkins Good entered the Shadows.,117,"10 Runs collected.
Incoming Shadow Fax...
Jenkins Good is replaced by Mags Banananana.",191
